pmid	doi	title	abstract	year	month	day	jabbrv	lastname	firstname
23996088	10.1182/blood-2013-03-491316	Variation at 10p12.2 and 10p14 influences risk of childhood B-cell acute lymphoblastic leukemia and phenotype.	Acute lymphoblastic leukemia (ALL) is the major pediatric cancer diagnosed in economically developed countries with B-cell precursor (BCP)-ALL, accounting for approximately 70% of ALL. Recent genome-wide association studies (GWAS) have provided the first unambiguous evidence for common inherited susceptibility to BCP-ALL, identifying susceptibility loci at 7p12.2, 9p21.3, 10q21.2, and 14q11.2. To identify additional BCP-ALL susceptibility loci, we conducted a GWAS and performed a meta-analysis with a published GWAS totaling 1658 cases and 4723 controls, with validation in 1449 cases and 1488 controls. Combined analysis identified novel loci mapping to 10p12.2 (rs10828317, odds ratio [OR] = 1.23; P = 2.30 × 10(-9)) and 10p14 marked by rs3824662 (OR = 1.31; P = 8.62 × 10(-12)). The single nucleotide polymorphism rs10828317 is responsible for the N215S polymorphism in exon 7 of PIP4K2A, and rs3824662 localizes to intron 3 of the transcription factor and putative tumor suppressor gene GATA3. The rs10828317 association was shown to be specifically associated with hyperdiploid ALL, whereas the rs3824662-associated risk was confined to nonhyperdiploid non-TEL-AML1 + ALL. The risk allele of rs3824662 was correlated with older age at diagnosis (P &lt; .001) and significantly worse event-free survivorship (P &lt; .0001). These findings provide further insights into the genetic and biological basis of inherited genetic susceptibility to BCP-ALL and the influence of constitutional genotype on disease development. 	2014	01	07	Blood	Migliorini	Gabriele
24013273	10.1007/s00432-013-1512-3	Intron 3 of the ARID5B gene: a hot spot for acute lymphoblastic leukemia susceptibility.	Single-nucleotide polymorphisms (SNPs) in AT-rich interactive domain 5B (ARID5B) have been associated with risk for pediatric acute lymphoblastic leukemia (ALL). After reviewing previous studies, we realized that the most significant associations were restricted to intron 3, but the mechanism(s) by which those SNPs affect ALL risk remain to be elucidated. Therefore, the aim of this study was to analyze the association between genetic variants of the intron 3 region of ARID5B and the incidence of B-ALL in a Spanish population. We also aimed to find a functional explanation for the association, searching for copy number variations (CNVs), and changes in ARID5B expression associated with the genotypes of the SNPs. We analyzed 10 SNPs in intron 3 of ARID5B in a Spanish population of 219 B-ALL patients and 397 unrelated controls with the Taqman Open Array platform. CNVs were analyzed in 23 patients and 17 controls using the Cytogenetics Whole-genome 2.7 M platform. Expression of ARID5B transcript 1 was quantified by qPCR and related to SNPs genotype in seven ALL cell lines. Association between intron 3 and B-ALL risk was confirmed for all of the SNPs evaluated in our Spanish population. We could not explain this association by the presence of CNVs. We neither detected changes in the expression of ARID5B isoform associated with the genotype of the SNPs. The intron 3 of ARID5B gene was found to be strongly associated with B-ALL risk in the Spanish population examined. However, neither CNVs nor changes in mRNA expression were found to be responsible for this association.	2013	12	16	J Cancer Res Clin Oncol	Gutiérrez-Camino	Ángela
22076464	10.1038/leu.2011.302	Identification of germline susceptibility loci in ETV6-RUNX1-rearranged childhood acute lymphoblastic leukemia.	Acute lymphoblastic leukemia (ALL) is a malignant disease of the white blood cells. The etiology of ALL is believed to be multifactorial and likely to involve an interplay of environmental and genetic variables. We performed a genome-wide association study of 355 750 single-nucleotide polymorphisms (SNPs) in 474 controls and 419 childhood ALL cases characterized by a t(12;21)(p13;q22) - the most common chromosomal translocation observed in childhood ALL - which leads to an ETV6-RUNX1 gene fusion. The eight most strongly associated SNPs were followed-up in 951 ETV6-RUNX1-positive cases and 3061 controls from Germany/Austria and Italy, respectively. We identified a novel, genome-wide significant risk locus at 3q28 (TP63, rs17505102, P(CMH)=8.94 × 10(-9), OR=0.65). The separate analysis of the combined German/Austrian sample only, revealed additional genome-wide significant associations at 11q11 (OR8U8, rs1945213, P=9.14 × 10(-11), OR=0.69) and 8p21.3 (near INTS10, rs920590, P=6.12 × 10(-9), OR=1.36). These associations and another association at 11p11.2 (PTPRJ, rs3942852, P=4.95 × 10(-7), OR=0.72) remained significant in the German/Austrian replication panel after correction for multiple testing. Our findings demonstrate that germline genetic variation can specifically contribute to the risk of ETV6-RUNX1-positive childhood ALL. The identification of TP63 and PTPRJ as susceptibility genes emphasize the role of the TP53 gene family and the importance of proteins regulating cellular processes in connection with tumorigenesis.	2012	07	05	Leukemia	Ellinghaus	E
22291082	10.1200/JCO.2011.38.0345	ARID5B genetic polymorphisms contribute to racial disparities in the incidence and treatment outcome of childhood acute lymphoblastic leukemia.	Recent genome-wide screens have identified genetic variations in ARID5B associated with susceptibility to childhood acute lymphoblastic leukemia (ALL). We sought to determine the contribution of ARID5B single nucleotide polymorphisms (SNPs) to racial disparities in ALL susceptibility and treatment outcome. We compared the association between ARID5B SNP genotype and ALL susceptibility in whites (&gt; 95% European genetic ancestry; 978 cases and 1,046 controls) versus in Hispanics (&gt; 10% Native American ancestry; 330 cases and 541 controls). We determined the relationships between ARID5B SNP genotype and ALL relapse risk in 1,605 children treated on the Children's Oncology Group (COG) P9904/9905 clinical trials. Among 49 ARID5B SNPs interrogated, 10 were significantly associated with ALL susceptibility in both whites and Hispanics (P &lt; .05), with risk alleles consistently more frequent in Hispanics than in whites. rs10821936 exhibited the most significant association in both races (P = 8.4 × 10(-20) in whites; P = 1 × 10(-6) in Hispanics), and genotype at this SNP was highly correlated with local Native American genetic ancestry (P = 1.8 × 10(-8)). Multivariate analyses in Hispanics identified an additional SNP associated with ALL susceptibility independent of rs10821936. Eight ARID5B SNPs were associated with both ALL susceptibility and relapse hazard; the alleles related to higher ALL incidence were always linked to poorer treatment outcome and were more frequent in Hispanics. ARID5B polymorphisms are important determinants of childhood ALL susceptibility and treatment outcome, and they contribute to racial disparities in this disease.	2012	06	08	J Clin Oncol	Xu	Heng
22660188	10.1038/leu.2012.148	Genetic polymorphisms and childhood acute lymphoblastic leukemia: GWAS of the ESCALE study (SFCE).	NA	2013	02	12	Leukemia	Orsi	L
23016962	10.1111/bjh.12063	Genetic polymorphisms in ARID5B, CEBPE, IKZF1 and CDKN2A in relation with risk of acute lymphoblastic leukaemia in adults: a Group for Research on Adult Acute Lymphoblastic Leukaemia (GRAALL) study.	NA	2013	04	04	Br J Haematol	Peyrouze	Pauline
23021489	10.1186/1755-8794-5-42	Candidate gene association study in pediatric acute lymphoblastic leukemia evaluated by Bayesian network based Bayesian multilevel analysis of relevance.	We carried out a candidate gene association study in pediatric acute lymphoblastic leukemia (ALL) to identify possible genetic risk factors in a Hungarian population. The results were evaluated with traditional statistical methods and with our newly developed Bayesian network based Bayesian multilevel analysis of relevance (BN-BMLA) method. We collected genomic DNA and clinical data from 543 children, who underwent chemotherapy due to ALL, and 529 healthy controls. Altogether 66 single nucleotide polymorphisms (SNPs) in 19 candidate genes were genotyped. With logistic regression, we identified 6 SNPs in the ARID5B and IKZF1 genes associated with increased risk to B-cell ALL, and two SNPs in the STAT3 gene, which decreased the risk to hyperdiploid ALL. Because the associated SNPs were in linkage in each gene, these associations corresponded to one signal per gene. The odds ratio (OR) associated with the tag SNPs were: OR = 1.69, P = 2.22x10(-7) for rs4132601 (IKZF1), OR = 1.53, P = 1.95x10(-5) for rs10821936 (ARID5B) and OR = 0.64, P = 2.32x10(-4) for rs12949918 (STAT3). With the BN-BMLA we confirmed the findings of the frequentist-based method and received additional information about the nature of the relations between the SNPs and the disease. E.g. the rs10821936 in ARID5B and rs17405722 in STAT3 showed a weak interaction, and in case of T-cell lineage sample group, the gender showed a weak interaction with three SNPs in three genes. In the hyperdiploid patient group the BN-BMLA detected a strong interaction among SNPs in the NOTCH1, STAT1, STAT3 and BCL2 genes. Evaluating the survival rate of the patients with ALL, the BN-BMLA showed that besides risk groups and subtypes, genetic variations in the BAX and CEBPA genes might also influence the probability of survival of the patients. In the present study we confirmed the roles of genetic variations in ARID5B and IKZF1 in the susceptibility to B-cell ALL. With the newly developed BN-BMLA method several gene-gene, gene-phenotype and phenotype-phenotype connections were revealed. We showed several advantageous features of the new method, and suggested that in gene association studies the BN-BMLA might be a useful supplementary to the traditional frequentist-based statistical method.	2013	03	05	BMC Med Genomics	Lautner-Csorba	Orsolya
23114164		[Research advances on correlation of ARID5B gene with childhood acute lymphoblastic leukemia - review].	Childhood acute lymphoblastic leukemia (C-ALL) is the most common pediatric cancer. Although its etiology remains poorly understood, the hypothesis of ALL correlated with a genetic basis was examined through association studies based on candidate genes. Recently, two independent large-scale genome-wide association studies reported that the five single nucleotide polymorphisms (rs7073837; rs10821936; rs10994982; rs7089424; rs10740055) in the gene AT rich interactive domain 5B (ARID5B) at 10q21.2, were associated with the high incidence risk of C-ALL, especially with hyperdiploid lymphoblastic leukemia. Variations in these single nucleotide polymorphisms influence the risk of specific disease subtypes, and also possess race- and sex-differences in leukemia incidence. Further elucidation of the mechanisms through which ARID5B variants are involved in C-ALL not only has a great diagnostic value, but also a guidance for the clinical therapy, ultimately improving the prognosis of disease. Therefore, the related studies of ARID5B with C-ALL were summarized briefly in this review.	2013	12	05	Zhongguo Shi Yan Xue Ye Xue Za Zhi	Qian	Xi-Feng
21889209	10.1016/j.leukres.2011.07.034	Role of 657del5 NBN mutation and 7p12.2 (IKZF1), 9p21 (CDKN2A), 10q21.2 (ARID5B) and 14q11.2 (CEBPE) variation and risk of childhood ALL in the Polish population.	Recent studies have shown that SNPs mapping to 7p12.2 (IKZF1), 9p21 (CDKN2A), 10q21.2 (ARID5B), and 14q11.2 (CEBPE) and carrier status for recessively inherited Nijmegen Breakage syndrome (NBS) influence childhood acute lymphoblastic leukemia (ALL) risk. To examine these relationship, we analysed 398 ALL cases and 731 controls from Poland. Statistically significant association between genotype at 7p12.2 (IKZF1), 10q21.2 (ARID5B) and the NBS associated locus, 8q21.3 (NBN) and ALL risk was found; odds ratios (ORs), 1.34 (P=0.002), 1.33 (P=0.003), and 1325.21 (P=0.0028), respectively. These data provide further insights into the biological basis of ALL highlighting the existence of both common and rare disease susceptibility variants.	2011	12	14	Leuk Res	Pastorczak	Agata
20042726	10.1182/blood-2009-09-241513	Verification of the susceptibility loci on 7p12.2, 10q21.2, and 14q11.2 in precursor B-cell acute lymphoblastic leukemia of childhood.	Recent genome-wide association data have implicated genetic variation at 7p12.2 (IKZF1), 10q21.2 (ARIDB5), and 14q11.2 (CEBPE) in the etiology of B-cell childhood acute lymphoblastic leukemia (ALL). To verify and further examine the relationship between these variants and ALL risk, we genotyped 1384 cases of precursor B-cell childhood ALL and 1877 controls from Germany and the United Kingdom. The combined data provided statistically significant support for an association between genotype at each of these loci and ALL risk; odds ratios (OR), 1.69 (P = 7.51 x10(-22)), 1.80 (P = 5.90 x 10(-28)), and 1.27 (P = 4.90 x 10(-6)), respectively. Furthermore, the risk of ALL increases with an increasing numbers of variant alleles for the 3 loci (OR(per-allele) = 1.53, 95% confidence interval, 1.44-1.62; P(trend) = 3.49 x 10(-42)), consistent with a polygenic model of disease susceptibility. These data provide unambiguous evidence for the role of these variants in defining ALL risk underscoring approximately 64% of cases.	2010	04	02	Blood	Prasad	Rashmi B
20054350	10.1038/leu.2009.277	ARID5B SNP rs10821936 is associated with risk of childhood acute lymphoblastic leukemia in blacks and contributes to racial differences in leukemia incidence.	NA	2010	05	20	Leukemia	Yang	W
20189245	10.1016/j.leukres.2010.02.001	Genome-wide association study of childhood acute lymphoblastic leukemia in Korea.	We conducted a genome-wide association study of childhood acute lymphoblastic leukemia (ALL) in a case-control study conducted in Korea. Incident childhood ALL cases (n=50) and non-cancer controls (n=50) frequency-matched to cases by age and sex, recruited from three teaching hospitals in Seoul between 2003 and 2008, were genotyped using Affymetrix SNP Array 6.0 platform. ALL risks were estimated as odds ratios (ORs) and 95% confidence intervals (CIs) adjusted for age and birth weight. The false discovery rate (FDR) was used for adjusting multiple tests. Of these 1 million SNPs, six SNPs in 4 genes (HAO1 rs6140264, EPB41L2 rs9388856, rs9388857, rs1360756, C2orf3 12105972, MAN2A1 rs3776932) were strongly associated with childhood ALL risk (P(dominant)&lt;or=0.0001 and P(trend)&lt;0.006). These SNPs remained significant after FDR adjustment (FDR value &lt;0.2). Our genome-wide association study in Korea children identified a few genetic variations as potential susceptibility markers for ALL, warranting further replication studies among various ethnic groups.	2010	09	30	Leuk Res	Han	Sohee
20460642	10.3324/haematol.2010.022459	Replication analysis confirms the association of ARID5B with childhood B-cell acute lymphoblastic leukemia.	Although childhood acute lymphoblastic leukemia is the most common pediatric cancer, its etiology remains poorly understood. In an attempt to replicate the findings of 2 recent genome-wide association studies in a French-Canadian cohort, we confirmed the association of 5 SNPs [rs7073837 (P=4.2 x 10(-4)), rs10994982 (P=3.8 x 10(-4)), rs10740055 (P=1.6 x 10(-5)), rs10821936 (P=1.7 x 10(-7)) and rs7089424 (P=3.6 x 10(-7))] in the ARID5B gene with childhood acute lymphoblastic leukemia. We also confirmed a selective effect for B-cell acute lymphoblastic leukemia with hyperdiploidy and report a putative gender-specific effect of ARID5B SNPs on acute lymphoblastic leukemia risk in males. This study provides a strong rationale for more detailed analysis to identify the causal variants at this locus and to better understand the overall functional contribution of ARID5B to childhood acute lymphoblastic leukemia susceptibility.	2012	11	08	Haematologica	Healy	Jasmine
20538337	10.1016/j.leukres.2010.05.013	Genetic variation and the risk of acute lymphoblastic leukemia.	NA	2010	09	30	Leuk Res	Mullighan	Charles G
21098271	10.1073/pnas.1006981107	Genetic landscape of high hyperdiploid childhood acute lymphoblastic leukemia.	High hyperdiploid acute lymphoblastic leukemia (ALL) is one of the most common malignancies in children. It is characterized by gain of chromosomes, typically +X, +4, +6, +10, +14, +17, +18, and +21,+21; little is known about additional genetic aberrations. Approximately 20% of the patients relapse; therefore it is clinically important to identify risk-stratifying markers. We used SNP array analysis to investigate a consecutive series of 74 cases of high hyperdiploid ALL. We show that the characteristic chromosomal gains are even more frequent than previously believed, indicating that karyotyping mistakes are common, and that almost 80% of the cases display additional abnormalities detectable by SNP array analysis. Subclonality analysis strongly implied that the numerical aberrations were primary and arose before structural events, suggesting that step-wise evolution of the leukemic clone is common. An association between duplication of 1q and +5 was seen (P = 0.003). Other frequent abnormalities included whole-chromosome uniparental isodisomies (wUPIDs) 9 and 11, gain of 17q not associated with isochromosome formation, extra gain of part of 21q, deletions of ETS variant 6 (ETV6), cyclin-dependent kinase inhibitor 2A (CKDN2A) and paired box 5 (PAX5), and PAN3 poly(A) specific ribonuclease subunit homolog (PAN3) microdeletions. Comparison of whole-chromosome and partial UPID9 suggested different pathogenetic outcomes, with the former not involving CDKN2A. Finally, two cases had partial deletions of AT rich interactive domain 5B (ARID5B), indicating that acquired as well as constitutional variants in this locus may be associated with pediatric ALL. Here we provide a comprehensive characterization of the genetic landscape of high hyperdiploid childhood ALL, including the heterogeneous pattern of secondary genetic events.	2011	05	12	Proc Natl Acad Sci U S A	Paulsson	Kajsa
19684603	10.1038/ng.432	Germline genomic variants associated with childhood acute lymphoblastic leukemia.	Using the Affymetrix 500K Mapping array and publicly available genotypes, we identified 18 SNPs whose allele frequency differed significantly(P &lt; 1 x 10(-5)) between pediatric acute lymphoblastic leukemia (ALL) cases (n = 317) and non-ALL controls (n = 17,958). Two SNPs in ARID5B not only differed between ALL and non-ALL groups (rs10821936, P = 1.4 x 10(-15), odds ratio (OR) = 1.91; rs10994982, P = 5.7 x 10(-9), OR = 1.62) but also distinguished B-hyperdiploid ALL from other subtypes (rs10821936, P = 1.62 x 10(-5), OR = 2.17; rs10994982, P = 0.003, OR 1.72). These ARID5B SNPs also distinguished B-hyperdiploid ALL from other subtypes in an independent validation cohort (n = 124 children with ALL; P = 0.003 and P = 0.0008, OR 2.45 and 2.86, respectively) and were associated with methotrexate accumulation and gene expression pattern in leukemic lymphoblasts. We conclude that germline variants affect susceptibility to, and characteristics of, specific ALL subtypes.	2009	09	28	Nat Genet	Treviño	Lisa R
19684604	10.1038/ng.430	Loci on 7p12.2, 10q21.2 and 14q11.2 are associated with risk of childhood acute lymphoblastic leukemia.	To identify risk variants for childhood acute lymphoblastic leukemia (ALL), we conducted a genome-wide association study of two case-control series, analyzing the genotypes with respect to 291,423 tagging SNPs in a total of 907 ALL cases and 2,398 controls. We identified risk loci for ALL at 7p12.2 (IKZF1, rs4132601, odds ratio (OR) = 1.69, P = 1.20 x 10(-19)), 10q21.2 (ARID5B, rs7089424, OR = 1.65, P = 6.69 x 10(-19)) and 14q11.2 (CEBPE, rs2239633, OR = 1.34, P = 2.88 x 10(-7)). The 10q21.2 (ARID5B) risk association appears to be selective for the subset of B-cell precursor ALL with hyperdiploidy. These data show that common low-penetrance susceptibility alleles contribute to the risk of developing childhood ALL and provide new insight into disease causation of this specific hematological cancer. Notably, all three risk variants map to genes involved in transcriptional regulation and differentiation of B-cell progenitors.	2009	09	28	Nat Genet	Papaemmanuil	Elli
19710713	10.1038/ng0909-957	Inherited susceptibility to pediatric acute lymphoblastic leukemia.	Although genome-wide analyses have identified somatic alterations contributing to the pathogenesis of pediatric acute lymphoblastic leukemia (ALL), few studies have identified germline variants conferring risk of this disease. Two reports now provide the first genome-wide glimpse into the role of inherited alleles in ALL pathogenesis.	2009	09	28	Nat Genet	Levine	Ross L
35482846	10.1080/15548627.2022.2071382	Mutations in V-ATPase in follicular lymphoma activate autophagic flux creating a targetable dependency.	The recent discovery of recurrent gene mutations in chaperones or components of the vacuolar-type H<sup>+</sup>-translocating ATPase (V-ATPase) in follicular lymphoma (FL) was an unexpected finding. The application of whole exome sequencing and targeted gene re-sequencing has resulted in the identification of mutations in <i>ATP6AP1, ATP6V1B2</i> and <i>VMA21</i> in a combined 30% of FL, together constituting a major novel mutated pathway in this disease. Interestingly, no other human hematological malignancy carries these mutations at more than sporadic occurrences, implicating unique aspects of FL biology requiring these mutations. The mutations in ATP6V1B2 and VMA21 through separate mechanisms impair lysosomal V-ATPase activity resulting in an elevated lysosomal pH. The elevated lysosomal pH impairs protein and peptide hydrolysis and associates with reduced cytoplasmic amino acid concentrations resulting in compensatory activation of autophagic flux. The elevated autophagic flux constitutes a survival dependency for FL cells and can be targeted with inhibitors to ULK1 and multiple recently identified cyclin-dependent kinase inhibitors. Targeting autophagy alone or in combination with other targeted therapies constitutes a novel therapeutic opportunity for FL patients.	2022	05	31	Autophagy	Wang	Fangyang
26691987	10.1038/ng.3473	Recurrent mTORC1-activating RRAGC mutations in follicular lymphoma.	Follicular lymphoma is an incurable B cell malignancy characterized by the t(14;18) translocation and mutations affecting the epigenome. Although frequent gene mutations in key signaling pathways, including JAK-STAT, NOTCH and NF-κB, have also been defined, the spectrum of these mutations typically overlaps with that in the closely related diffuse large B cell lymphoma (DLBCL). Using a combination of discovery exome and extended targeted sequencing, we identified recurrent somatic mutations in RRAGC uniquely enriched in patients with follicular lymphoma (17%). More than half of the mutations preferentially co-occurred with mutations in ATP6V1B2 and ATP6AP1, which encode components of the vacuolar H(+)-ATP ATPase (V-ATPase) known to be necessary for amino acid-induced activation of mTORC1. The RagC variants increased raptor binding while rendering mTORC1 signaling resistant to amino acid deprivation. The activating nature of the RRAGC mutations, their existence in the dominant clone and their stability during disease progression support their potential as an excellent candidate for therapeutic targeting. 	2016	06	03	Nat Genet	Okosun	Jessica
25713363	10.1073/pnas.1501199112	Mutations in early follicular lymphoma progenitors are associated with suppressed antigen presentation.	Follicular lymphoma (FL) is incurable with conventional therapies and has a clinical course typified by multiple relapses after therapy. These tumors are genetically characterized by B-cell leukemia/lymphoma 2 (BCL2) translocation and mutation of genes involved in chromatin modification. By analyzing purified tumor cells, we identified additional novel recurrently mutated genes and confirmed mutations of one or more chromatin modifier genes within 96% of FL tumors and two or more in 76% of tumors. We defined the hierarchy of somatic mutations arising during tumor evolution by analyzing the phylogenetic relationship of somatic mutations across the coding genomes of 59 sequentially acquired biopsies from 22 patients. Among all somatically mutated genes, CREBBP mutations were most significantly enriched within the earliest inferable progenitor. These mutations were associated with a signature of decreased antigen presentation characterized by reduced transcript and protein abundance of MHC class II on tumor B cells, in line with the role of CREBBP in promoting class II transactivator (CIITA)-dependent transcriptional activation of these genes. CREBBP mutant B cells stimulated less proliferation of T cells in vitro compared with wild-type B cells from the same tumor. Transcriptional signatures of tumor-infiltrating T cells were indicative of reduced proliferation, and this corresponded to decreased frequencies of tumor-infiltrating CD4 helper T cells and CD8 memory cytotoxic T cells. These observations therefore implicate CREBBP mutation as an early event in FL evolution that contributes to immune evasion via decreased antigen presentation. 	2015	05	11	Proc Natl Acad Sci U S A	Green	Michael R
