pmid	doi	title	abstract	year	month	day	jabbrv	lastname	firstname
25556945	10.1016/j.chembiol.2014.10.021	Activity-based probes for detection of active MALT1 paracaspase in immune cells and lymphomas.	MALT1 paracaspase is activated upon antigen receptor stimulation to promote lymphocyte activation. In addition, deregulated MALT1 protease activity drives survival of distinct lymphomas such as the activated B cell type of diffuse large B cell lymphoma (ABC-DLBCL). Here, we designed fluorophore or biotin-coupled activity based-probes (ABP) that covalently modify the active center of MALT1. MALT1-ABPs are exclusively labeling an active modified full length form of MALT1 upon T cell stimulation. Further, despite the CARMA1 requirement for initial MALT1 activation, the MALT1-ABPs show that protease activity is not confined to the high-molecular CARMA1-BCL10-MALT1 (CBM) complex. Using biotin-coupled ABPs, we developed a robust assay for sensitive and selective detection of active MALT1 in cell lines, primary lymphocytes, and DLBCL tumor biopsies. Taken together, MALT1-ABPs represent powerful chemical tools to measure cellular MALT1 activation, determine efficacy of small molecule inhibitors, and classify lymphomas based on MALT1 activity status.	2015	09	29	Chem Biol	Eitelhuber	Andrea C
25569716	10.1038/ncomms6908	Conversion of the LIMA1 tumour suppressor into an oncogenic LMO-like protein by API2-MALT1 in MALT lymphoma.	MALT1 is the only known paracaspase and is a critical mediator of B- and T-cell receptor signalling. The function of the MALT1 gene is subverted by oncogenic chimeric fusions arising from the recurrent t(11;18)(q21;q21) aberration, which is the most frequent translocation in mucosa-associated lymphoid tissue (MALT) lymphoma. API2-MALT1-positive MALT lymphomas manifest antibiotic resistance and aggressive clinical behaviour with poor clinical outcome. However, the mechanisms underlying API2-MALT1-induced MALT lymphomagenesis are not fully understood. Here we show that API2-MALT1 induces paracaspase-mediated cleavage of the tumour suppressor protein LIMA1. LIMA1 binding by API2-MALT1 is API2 dependent and proteolytic cleavage is dependent on MALT1 paracaspase activity. Intriguingly, API2-MALT1-mediated proteolysis generates a LIM domain-only (LMO)-containing fragment with oncogenic properties in vitro and in vivo. Importantly, primary MALT lymphomas harbouring the API2-MALT1 fusion uniquely demonstrate LIMA1 cleavage fragments. Our studies reveal a novel paracaspase-mediated oncogenic gain-of-function mechanism in the pathogenesis of MALT lymphoma. 	2015	12	08	Nat Commun	Nie	Zilin
25736751	10.1007/978-1-4939-2422-6_12	Visualizing TCR-induced POLKADOTS formation and NF-κB activation in the D10 T-cell clone and mouse primary effector T cells.	T cells are an immune cell lineage that play a central role in protection against pathogen infection. Antigen, in the form of pathogen-derived peptides, stimulates the T-cell receptor (TCR), leading to activation of the transcription factor, nuclear factor kappa B (NF-κB). The subsequent NF-κB-dependent gene expression program drives expansion and effector differentiation of antigen-specific T cells, leading to the adaptive anti-pathogen immune response. The cell surface TCR transmits activating signals to cytosolic NF-κB by a complex signaling cascade, in which the adapter protein Bcl10 plays a key role. We have previously demonstrated that TCR engagement leads to the formation of cytosolic Bcl10 clusters, called POLKADOTS, that provide a platform for the assembly of the terminal signaling complex that ultimately mediates NF-κB activation. In this chapter, we describe the methods utilized to visualize the formation of TCR-induced POLKADOTS and to study the temporal association between POLKADOTS formation and nuclear translocation of the NF-κB subunit, RelA/p65. 	2015	11	20	Methods Mol Biol	Paul	Suman
25748427	10.1371/journal.pone.0119363	MALT1-ubiquitination triggers non-genomic NF-κB/IKK signaling upon platelet activation.	We have recently shown that IKK complex plays an important non-genomic role in platelet function, i.e., regulates SNARE machinery-dependent membrane fusion. In this connection, it is well known that MALT1, whose activity is modulated by proteasome, plays an important role in the regulation of IKK complex. Therefore, the present studies investigated the mechanism by which IKK signaling is regulated in the context of the platelet proteasome. It was found that platelets express a functional proteasome, and form CARMA/MALT1/Bcl10 (CBM) complex when activated. Using a pharmacological inhibitor, the proteasome was found to regulate platelet function (aggregation, integrin activation, secretion, phosphatidylserine exposure and changes in intracellular calcium). It was also found to regulate thrombogenesis and physiologic hemostasis. We also observed, upon platelet activation, that MALT1 is ubiquitinated, and this coincides with the activation of the IKK/NF-κB-signaling pathway. Finally, we observed that the proteasome inhibitor blocks CBM complex formation and the interaction of IKKγ and MALT1; abrogates SNARE formation, and the association of MALT1 with TAK1 and TAB2, which are upstream of the CBM complex. Thus, our data demonstrate that MALT1 ubiquitination is critical for the engagement of CBM and IKK complexes, thereby directing platelet signals to the NF-κB pathway. 	2016	01	14	PLoS One	Karim	Zubair A
25849213	10.1371/journal.pone.0122365	Functional characterization of zebrafish (Danio rerio) Bcl10.	The complexes formed by BCL10, MALT1 and specific members of the family of CARMA proteins (CBM complex), have recently focused much attention because they represent a central hub regulating activation of the transcription factor NF-κB following various cellular stimulations. In this manuscript, we report the functional characterization of a Danio rerio 241 amino acids polypeptide ortholog of the Caspase recruiting domain (CARD)-containing protein BCL10. Biochemical studies show that zebrafish Bcl10 (zBcl10) dimerizes and binds to components of the CBM complex. Fluorescence microscopy observations demonstrate that zBcl10 forms cytoplasmic filaments similar to that formed by human BCL10 (hBCL10). Functionally, in human cells zBcl10 is more effective in activating NF-κB compared to hBCL10, possibly due to the lack of carboxy-terminal inhibitory serine residues present in the human protein. Also, depletion experiments carried out through expression of short hairpin RNAs targeting hBCL10 indicate that zBcl10 can functionally replace the human protein. Finally, we show that the zebrafish cell line PAC2 is suitable to carry out reporter assays for monitoring the activation state of NF- kB transcription factor. In conclusion, this work shows that zebrafish may excellently serve as a model organism to study complex and intricate signal transduction pathways, such as those that control NF-κB activation. 	2016	03	31	PLoS One	Mazzone	Pellegrino
25956014	10.1016/j.jaci.2015.02.037	Advances in basic and clinical immunology in 2014.	Genetic identification of immunodeficiency syndromes has become more efficient with the availability of whole-exome sequencing, expediting the identification of relevant genes and complementing traditional linkage analysis and homozygosity mapping. New genes defects causing immunodeficiency include phophoglucomutase 3 (PGM3), cytidine 5' triphosphate synthase 1 (CTPS1), nuclear factor κB-inducing kinase (NIK), cytotoxic T lymphocyte-associated antigen 4 (CTLA4), B-cell chronic lymphocytic leukemia/lymphoma 10 (BCL10), phosphoinositide-3 kinase regulatory subunit 1 (PIK3R1), IL21, and Jagunal homolog 1 (JAGN1). New case reports expanded the clinical spectrum of gene defects. For example, a specific recombination-activating gene 1 variant protein with partial recombinant activity might produce Omenn syndrome or a common variable immunodeficiency phenotype. Central and peripheral B-cell tolerance was investigated in patients with several primary immunodeficiencies, including common variable immunodeficiency and Wiskott-Aldrich syndrome, to explain the occurrence of autoimmunity and inflammatory disorders. The role of IL-12 and IL-15 in the enhancement of natural killer cell activity was reported. Newborn screening for T-cell deficiency is being implemented in more states and is achieving its goal of defining the true incidence of severe combined immunodeficiency and providing early treatment that offers the highest survival for these patients. Definitive treatment of severe immunodeficiency with both hematopoietic stem cell transplantation and gene therapy was reported to be successful, with increasing definition of conditions needed for optimal outcomes. Progress in HIV infection is directed toward the development of an effective vaccine and the eradication of hidden latent virus reservoirs. 	2015	07	23	J Allergy Clin Immunol	Chinen	Javier
25965667	10.1371/journal.pone.0127083	MALT1 Protease Activity Is Required for Innate and Adaptive Immune Responses.	CARMA-BCL10-MALT1 signalosomes play important roles in antigen receptor signaling and other pathways. Previous studies have suggested that as part of this complex, MALT1 functions as both a scaffolding protein to activate NF-κB through recruitment of ubiquitin ligases, and as a protease to cleave and inactivate downstream inhibitory signaling proteins. However, our understanding of the relative importance of these two distinct MALT1 activities has been hampered by a lack of selective MALT1 protease inhibitors with suitable pharmacologic properties. To fully investigate the role of MALT1 protease activity, we generated mice homozygous for a protease-dead mutation in MALT1. We found that some, but not all, MALT1 functions in immune cells were dependent upon its protease activity. Protease-dead mice had defects in the generation of splenic marginal zone and peritoneal B1 B cells. CD4+ and CD8+ T cells displayed decreased T cell receptor-stimulated proliferation and IL-2 production while B cell receptor-stimulated proliferation was partially dependent on protease activity. In dendritic cells, stimulation of cytokine production through the Dectin-1, Dectin-2, and Mincle C-type lectin receptors was also found to be partially dependent upon protease activity. In vivo, protease-dead mice had reduced basal immunoglobulin levels, and showed defective responses to immunization with T-dependent and T-independent antigens. Surprisingly, despite these decreased responses, MALT1 protease-dead mice, but not MALT1 null mice, developed mixed inflammatory cell infiltrates in multiple organs, suggesting MALT1 protease activity plays a role in immune homeostasis. These findings highlight the importance of MALT1 protease activity in multiple immune cell types, and in integrating immune responses in vivo. 	2016	02	19	PLoS One	Yu	Jong W
25973362	10.1016/j.fob.2015.04.011	Oligomerized CARD16 promotes caspase-1 assembly and IL-1β processing.	Increasing evidence indicates that caspase recruitment domain (CARD)-mediated caspase-1 (CASP1) assembly is an essential process for its activation and subsequent interleukin (IL)-1β release, leading to the initiation of inflammation. Both CARD16 and CARD17 were previously reported as inhibitory homologs of CASP1; however, their molecular function remains unclear. Here, we identified that oligomerization activity allows CARD16 to function as a CASP1 activator. We investigated the molecular characteristics of CARD16 and CARD17 in transiently transfected HeLa cells. Although both CARD16 and CARD17 interacted with CASP1CARD, only CARD16 formed a homo-oligomer. Oligomerized CARD16 formed a filament-like structure with CASP1CARD and a speck with apoptosis-associated speck-like protein containing a CARD. A filament-like structure formed by CARD16 promoted CASP1 filament assembly and IL-1β release. In contrast, CARD17 did not form a homo-oligomer or filaments and inhibited CASP1-dependent IL-1β release. Mutated CARD16D27G, mimicking the CARD17 amino acid sequence, formed a homo-oligomer but failed to form a filament-like structure. Consequently, CARD16D27G weakly promoted CASP1 filament assembly and subsequent IL-1β release. These results suggest that oligomerized CARD16 promotes CARD-mediated molecular assembly and CASP1 activation. 	2015	05	14	FEBS Open Bio	Karasawa	Tadayoshi
26038114	10.15252/msb.20145880	Systems-wide analysis of BCR signalosomes and downstream phosphorylation and ubiquitylation.	B-cell receptor (BCR) signaling is essential for the development and function of B cells; however, the spectrum of proteins involved in BCR signaling is not fully known. Here we used quantitative mass spectrometry-based proteomics to monitor the dynamics of BCR signaling complexes (signalosomes) and to investigate the dynamics of downstream phosphorylation and ubiquitylation signaling. We identify most of the previously known components of BCR signaling, as well as many proteins that have not yet been implicated in this system. BCR activation leads to rapid tyrosine phosphorylation and ubiquitylation of the receptor-proximal signaling components, many of which are co-regulated by both the modifications. We illustrate the power of multilayered proteomic analyses for discovering novel BCR signaling components by demonstrating that BCR-induced phosphorylation of RAB7A at S72 prevents its association with effector proteins and with endo-lysosomal compartments. In addition, we show that BCL10 is modified by LUBAC-mediated linear ubiquitylation, and demonstrate an important function of LUBAC in BCR-induced NF-κB signaling. Our results offer a global and integrated view of BCR signaling, and the provided datasets can serve as a valuable resource for further understanding BCR signaling networks. 	2016	03	01	Mol Syst Biol	Satpathy	Shankha
26202083	10.3892/ijmm.2015.2290	Bcl10 crucially nucleates the pro-apoptotic complexes comprising PDK1, PKCζ and caspase-3 at the nuclear envelope of etoposide-treated human cervical carcinoma C4-I cells.	Protein kinase (PK)Cζ signaling at various subcellular levels affects cell survival, differentiation, growth and/or apoptosis. However, the mechanisms modulating PKCζ activity at the nuclear membrane (NM) are not yet fully understood. Previously, we demonstrated that PKCζ interacts with the B‑cell lymphoma 10 (Bcl10) protein at the NM of human cervical carcinoma (HCC) C4‑I cells. In the present study, we aimed to further clarify the interactions between PKCζ, Bcl10 and other proteins co-immunoprecipitated from NMs isolated from untreated and etoposide (also known as VP‑16; 2.0 µg/ml)‑treated C4‑I cells using biochemical and proteomics analyses. Aside from the Bcl10 protein, 3‑phosphoinositide‑dependent protein kinase‑1 (PDK1) also co-immunoprecipitated with PKCζ from NMs of C4‑I cells, indicating the assembly of a heterotrimeric complex, which increased with time in VP‑16‑exposed cells, as did the activity of PDK1‑phosphorylated‑PKCζ. In turn, PKCζ‑phosphorylated‑Bcl10 straddled an enlarged complex which comprised caspase‑3. Subsequently, activity‑enhanced caspase‑3 cleaved and inactivated PKCζ. Finally, the suppression of Bcl10 using specific siRNA or lentiviral transduction prevented the increase in the PDK1•PKCζ association, the increase in the activity of PKCζ and caspase‑3, as well as the caspase‑3‑mediated PKCζ proteolysis and inactivation from occurring at the NMs of the VP‑16‑exposed C4‑I cells. Our observations provide evidence that Bcl10 acts as a pivotal pro-apoptotic protein which crucially nucleates complexes comprising PDK1, PKCζ and active caspase‑3 at the NMs of VP‑16‑exposed C4‑I cells. Hence, our data suggest that Bcl10 and PKCζ are potential therapeutic targets in the treatment of HCC.	2016	05	09	Int J Mol Med	Chiarini	Anna
26277595	10.1016/j.jaci.2015.06.031	Genetic errors of the human caspase recruitment domain-B-cell lymphoma 10-mucosa-associated lymphoid tissue lymphoma-translocation gene 1 (CBM) complex: Molecular, immunologic, and clinical heterogeneity.	Three members of the caspase recruitment domain (CARD) family of adaptors (CARD9, CARD10, and CARD11) are known to form heterotrimers with B-cell lymphoma 10 (BCL10) and mucosa-associated lymphoid tissue lymphoma-translocation gene 1 (MALT1). These 3 CARD-BCL10-MALT1 (CBM) complexes activate nuclear factor κB in both the innate and adaptive arms of immunity. Human inherited defects of the 3 components of the CBM complex, including the 2 adaptors CARD9 and CARD11 and the 2 core components BCL10 and MALT1, have recently been reported. Biallelic loss-of-function mutant alleles underlie several different immunologic and clinical phenotypes, which can be assigned to 2 distinct categories. Isolated invasive fungal infections of unclear cellular basis are associated with CARD9 deficiency, whereas a broad range of clinical manifestations, including those characteristic of T- and B-lymphocyte defects, are associated with CARD11, MALT1, and BCL10 deficiencies. Interestingly, human subjects with these mutations have some features in common with the corresponding knockout mice, but other features are different between human subjects and mice. Moreover, germline and somatic gain-of-function mutations of MALT1, BCL10, and CARD11 have also been found in patients with other lymphoproliferative disorders. This broad range of germline and somatic CBM lesions, including loss-of-function and gain-of-function mutations, highlights the contribution of each of the components of the CBM complex to human immunity. 	2016	02	29	J Allergy Clin Immunol	Pérez de Diego	Rebeca
26287604	10.18632/oncotarget.4467	Immunodeficiency and CARD-BCL10-MALT1.	NA	2016	07	14	Oncotarget	Pérez de Diego	Rebeca
26525107	10.1038/ncomms9777	The paracaspase MALT1 cleaves HOIL1 reducing linear ubiquitination by LUBAC to dampen lymphocyte NF-κB signalling.	Antigen receptor signalling activates the canonical NF-κB pathway via the CARD11/BCL10/MALT1 (CBM) signalosome involving key, yet ill-defined roles for linear ubiquitination. The paracaspase MALT1 cleaves and removes negative checkpoint proteins, amplifying lymphocyte responses in NF-κB activation and in B-cell lymphoma subtypes. To identify new human MALT1 substrates, we compare B cells from the only known living MALT1(mut/mut) patient with healthy MALT1(+/mut) family members using 10-plex Tandem Mass Tag TAILS N-terminal peptide proteomics. We identify HOIL1 of the linear ubiquitin chain assembly complex as a novel MALT1 substrate. We show linear ubiquitination at B-cell receptor microclusters and signalosomes. Late in the NF-κB activation cycle HOIL1 cleavage transiently reduces linear ubiquitination, including of NEMO and RIP1, dampening NF-κB activation and preventing reactivation. By regulating linear ubiquitination, MALT1 is both a positive and negative pleiotropic regulator of the human canonical NF-κB pathway-first promoting activation via the CBM--then triggering HOIL1-dependent negative-feedback termination, preventing reactivation.	2016	05	10	Nat Commun	Klein	Theo
26615705	10.1016/j.anndiagpath.2015.10.001	Antisecretory medication is associated with decreased Helicobacter pylori detection in gastric marginal zone lymphoma.	Helicobacter pylori status influences the prognosis and management of gastric extranodal marginal zone lymphoma of mucosa-associated lymphoid tissue (MALT lymphoma), so accurate determination of H pylori status is of clinical importance. The low rate of histologic H pylori positivity among gastric MALT lymphoma cases at our institution prompted investigation for possible causes. A case series of 24 patients as having gastric MALT lymphoma (with no diffuse large B-cell component) in a tertiary care setting between 1997 and 2010 was identified, and clinical records were reviewed. Immunohistochemical staining for H pylori and BCL10 was performed. This study received institutional review board approval (protocol number M13-033). Thirty-nine percent of cases (9/23) were H pylori positive by histology, and 4 additional patients had positive serologic results; overall, 57% of cases (13/23) were positive for H pylori. Treatment with antisecretory medications was associated with a lower likelihood of histologic positivity (13% among treated patients vs 75% among untreated; P = .04). Nuclear localization of BCL10 was seen in 2 cases and was not associated with H pylori status. Antisecretory medications decrease the likelihood of histologic detection of H pylori in gastric MALT lymphoma cases. Incorporation of results of serologic or other testing is needed to ensure correct classification with respect to H pylori status.	2016	09	15	Ann Diagn Pathol	Schaberg	Kurt B
26668357	10.1073/pnas.1507459112	Lymphomagenic CARD11/BCL10/MALT1 signaling drives malignant B-cell proliferation via cooperative NF-κB and JNK activation.	The aggressive activated B cell-like subtype of diffuse large B-cell lymphoma is characterized by aberrant B-cell receptor (BCR) signaling and constitutive nuclear factor kappa-B (NF-κB) activation, which is required for tumor cell survival. BCR-induced NF-κB activation requires caspase recruitment domain-containing protein 11 (CARD11), and CARD11 gain-of-function mutations are recurrently detected in human diffuse large B-cell lymphoma (DLBCL). To investigate the consequences of dysregulated CARD11 signaling in vivo, we generated mice that conditionally express the human DLBCL-derived CARD11(L225LI) mutant. Surprisingly, CARD11(L225LI) was sufficient to trigger aggressive B-cell lymphoproliferation, leading to early postnatal lethality. CARD11(L225LI) constitutively associated with B-cell CLL/lymphoma 10 (BCL10) and mucosa-associated lymphoid tissue lymphoma translocation gene 1 (MALT1) to simultaneously activate the NF-κB and c-Jun N-terminal kinase (JNK) signaling cascades. Genetic deficiencies of either BCL10 or MALT1 completely rescued the phenotype, and pharmacological inhibition of JNK was, similar to NF-κB blockage, toxic to autonomously proliferating CARD11(L225LI)-expressing B cells. Moreover, constitutive JNK activity was observed in primary human activated B cell-like (ABC)-DLBCL specimens, and human ABC-DLBCL cells were also sensitive to JNK inhibitors. Thus, our results demonstrate that enforced activation of CARD11/BCL10/MALT1 signaling is sufficient to drive transformed B-cell expansion in vivo and identify the JNK pathway as a therapeutic target for ABC-DLBCL. 	2016	08	11	Proc Natl Acad Sci U S A	Knies	Nathalie
26711259	10.1128/MCB.00876-15	Negative Regulation of CARD11 Signaling and Lymphoma Cell Survival by the E3 Ubiquitin Ligase RNF181.	NF-κB activation downstream of antigen receptor engagement is a highly regulated event required for lymphocyte activation during the adaptive immune response. The pathway is often dysregulated in lymphoma, leading to constitutive NF-κB activity that supports the aberrant proliferation of transformed lymphocytes. To identify novel regulators of antigen receptor signaling to NF-κB, we developed bioluminescence resonance energy transfer-based interaction cloning (BRIC), a screening strategy that can detect protein-protein interactions in live mammalian cells in a high-throughput manner. Using this strategy, we identified the RING finger protein RNF181 as an interactor of CARD11, a key signaling scaffold in the antigen receptor pathway. We present evidence that RNF181 functions as an E3 ubiquitin ligase to inhibit antigen receptor signaling to NF-κB downstream of CARD11. The levels of the obligate signaling protein Bcl10 are reduced by RNF181 even prior to signaling, and Bcl10 can serve as a substrate for RNF181 E3 ligase activity in vitro. Furthermore, RNF181 limits the proliferation of human diffuse large B cell lymphoma cells that depend upon aberrant CARD11 signaling to NF-κB for growth and survival in culture. Our results define a new regulatory checkpoint that can modulate the output of CARD11 signaling to NF-κB in both normal and transformed lymphocytes. 	2016	07	06	Mol Cell Biol	Pedersen	Sarah M
