pmid	doi	title	abstract	year	month	day	jabbrv	lastname	firstname
34753803	10.1158/1541-7786.MCR-21-0208	MALT1 Is a Targetable Driver of Epithelial-to-Mesenchymal Transition in Claudin-Low, Triple-Negative Breast Cancer.	MALT1 is the effector protein of the CARMA/Bcl10/MALT1 (CBM) signalosome, a multiprotein complex that drives pro-inflammatory signaling pathways downstream of a diverse set of receptors. Although CBM activity is best known for its role in immune cells, emerging evidence suggests that it plays a key role in the pathogenesis of solid tumors, where it can be activated by selected G protein-coupled receptors (GPCR). Here, we demonstrated that overexpression of GPCRs implicated in breast cancer pathogenesis, specifically the receptors for Angiotensin II and thrombin (AT1R and PAR1), drove a strong epithelial-to-mesenchymal transition (EMT) program in breast cancer cells that is characteristic of claudin-low, triple-negative breast cancer (TNBC). In concert, MALT1 was activated in these cells and contributed to the dramatic EMT phenotypic changes through regulation of master EMT transcription factors including Snail and ZEB1. Importantly, blocking MALT1 signaling, through either siRNA-mediated depletion of MALT1 protein or pharmacologic inhibition of its activity, was effective at partially reversing the molecular and phenotypic indicators of EMT. Treatment of mice with mepazine, a pharmacologic MALT1 inhibitor, reduced growth of PAR1+, MDA-MB-231 xenografts and had an even more dramatic effect in reducing the burden of metastatic disease. These findings highlight MALT1 as an attractive therapeutic target for claudin-low TNBCs harboring overexpression of one or more selected GPCRs. This study nominates a GPCR/MALT1 signaling axis as a pathway that can be pharmaceutically targeted to abrogate EMT and metastatic progression in TNBC, an aggressive form of breast cancer that currently lacks targeted therapies.	2022	04	27	Mol Cancer Res	Lee	Jia-Ying Lloyd
34783281	10.1080/10428194.2021.1999444	Targeting MALT1 for the treatment of diffuse large B-cell lymphoma.	The activated B-cell (ABC) subtype of diffuse large B-cell lymphoma (DLBCL) has an aggressive course and is associated with poor prognosis in the relapsed or refractory setting. ABC-DLBCL is characterized by chronic active signaling of NF-κB, which is dependent on the CARD11-BCL10-MALT1 (CBM) complex. MALT1 is a key effector of the CBM complex and activates canonical NF-κB and AP-1 among other transcription factors <i>via</i> distinct protease and scaffold functions. There is therefore growing interest in therapeutic targeting of MALT1 for B-cell malignancies. Here, we review recent advances in therapeutic targeting of MALT1 for ABC-DLBCL. Covalent and allosteric MALT1 protease inhibitors have been developed which inhibit growth of ABC-DLBCL in preclinical models, and two clinical MALT1 protease inhibitors are being developed in phase I clinical trials. Importantly, these compounds can overcome resistance to BTK inhibitors in preclinical models. Alternative compounds blocking the scaffold effect of MALT1 are also in early preclinical development. Blockade of MALT1 protease activity may have important implications for anti-lymphoma immunity by increasing immunogenicity of ABC-DLBCL cells and also by potentiating anti-lymphoma activity of other immune cells in the lymphoma microenvironment. Together, early data suggest that MALT1 is a promising target for ABC-DLBCL and possibly other B-cell malignancies, and can have lymphoma cell-intrinsic as well as immune-mediated therapeutic effects.	2022	04	20	Leuk Lymphoma	Seshadri	Madhav R
34906687	10.1016/j.fsi.2021.12.009	BCL10 regulates the production of proinflammatory cytokines by activating MAPK-NF-κB/Rel signaling pathway in oysters.	B cell lymphoma/leukemia 10 (BCL10) is an important member of the caspase recruitment domain-containing (CARD) protein family, which plays crucial roles in mediating the host inflammatory response. In the present study, a BCL10 homologue was identified from Pacific oyster Crassostrea gigas (designed as CgBCL10). The full length cDNA of CgBCL10 was of 897 bp with an open reading frame of 522 bp encoding a polypeptide of 174 amino acids containing a classical CARD domain. The deduced amino acid sequence of CgBCL10 shared low similarity with the previously identified BCL10s from other species. In the phylogenetic tree, CgBCL10 was firstly clustered with CvBCL10 from Crassostrea virginica and then assigned into the branch of invertebrate BCL10s. The mRNA transcripts of CgBCL10 were highly expressed in gonad, gill, adductor muscle, and haemocytes. After Vibrio splendidus stimulation, the mRNA expression level of CgBCL10 in haemocytes increased significantly (p &lt; 0.01) at 24, 72 and 96 h. In CgBCL10-RNAi oysters, the phosphorylation level of mitogen-activated protein kinases (MAPKs), nuclear translocation of NF-κB/Rel and activator protein-1 (AP-1) in haemocytes were inhibited, and the mRNA expressions of inflammatory cytokines including CgIL17-1, CgIL17-2, CgIL17-3, CgIL17-6 and CgTNF all decreased significantly (p &lt; 0.01) at 12 h after V. splendidus stimulation. These results suggested that CgBCL10 regulated the expression of inflammatory cytokines by activating MAPK kinase, and nuclear translocation of NF-κB/Rel and AP-1 to defense pathogen.	2022	02	25	Fish Shellfish Immunol	Zhang	Tong
35099607	10.1007/s00018-022-04154-z	A20 and ABIN-1 cooperate in balancing CBM complex-triggered NF-κB signaling in activated T cells.	T cell activation initiates protective adaptive immunity, but counterbalancing mechanisms are critical to prevent overshooting responses and to maintain immune homeostasis. The CARD11-BCL10-MALT1 (CBM) complex bridges T cell receptor engagement to NF-κB signaling and MALT1 protease activation. Here, we show that ABIN-1 is modulating the suppressive function of A20 in T cells. Using quantitative mass spectrometry, we identified ABIN-1 as an interactor of the CBM signalosome in activated T cells. A20 and ABIN-1 counteract inducible activation of human primary CD4 and Jurkat T cells. While A20 overexpression is able to silence CBM complex-triggered NF-κB and MALT1 protease activation independent of ABIN-1, the negative regulatory function of ABIN-1 depends on A20. The suppressive function of A20 in T cells relies on ubiquitin binding through the C-terminal zinc finger (ZnF)4/7 motifs, but does not involve the deubiquitinating activity of the OTU domain. Our mechanistic studies reveal that the A20/ABIN-1 module is recruited to the CBM complex via A20 ZnF4/7 and that proteasomal degradation of A20 and ABIN-1 releases the CBM complex from the negative impact of both regulators. Ubiquitin binding to A20 ZnF4/7 promotes destructive K48-polyubiquitination to itself and to ABIN-1. Further, after prolonged T cell stimulation, ABIN-1 antagonizes MALT1-catalyzed cleavage of re-synthesized A20 and thereby diminishes sustained CBM complex signaling. Taken together, interdependent post-translational mechanisms are tightly controlling expression and activity of the A20/ABIN-1 silencing module and the cooperative action of both negative regulators is critical to balance CBM complex signaling and T cell activation.	2022	02	03	Cell Mol Life Sci	Yin	Hongli
35192832	10.1016/j.scitotenv.2022.153990	Effects of gestational exposure to bisphenol A on the hepatic transcriptome and lipidome of rat dams: Intergenerational comparison of effects in the offspring.	Our previous studies demonstrated that prenatal bisphenol A (BPA) exposure affected the hepatic transcriptome and lipidome in rat offspring in a sex- and age-dependent manner. In this study, we investigated the effects of gestational exposure to BPA on the rat dams, after weaning period, and compared them with those of their offspring. Our results showed alterations in hepatic transcriptome related to insulin signaling, circadian rhythm, and infectious disease pathways in BPA-treated dams even 4 weeks after the exposure, whereas slight modifications on the lipid profile were found. Alterations in lipid and transcriptome profiles were more prominent in the prenatally BPA-exposed offspring at postnatal day (PND) 1 and 21 than those in the dams, suggesting that in utero exposure to BPA is more serious than exposure in the adulthood. Cryptochrome-1 (Cry1) and peroxisome proliferator-activated receptor delta (Ppard) were commonly altered in both dams and offspring. Nevertheless, the results of DIABLO (Data Integration Analysis for Biomarker discovery using Latent cOmponents), showed that multi-omics data successfully distinguished the exposed dams from the corresponding controls and their offspring with a high level of accuracy. The accuracy rates in BPA50 models (including control and 50 μg BPA/kg bw/day exposed groups) were smaller than those in BPA5000 models (control and 5000 μg BPA/kg bw/day exposed groups), suggesting dose-dependent severity in BPA effects. Palmitic acid and genes related to circadian rhythm, insulin responses, and lipid metabolism (e.g., 1-acylglycerol-3-phosphate O-acyltransferase 2 (Agpat2), B-cell CLL/lymphoma 10 (Bcl10), Cry1, Harvey rat sarcoma virus oncogene (Hras), and NLR family member X1 (Nlrx1)) were identified through DIABLO models as novel biomarkers of effects of BPA across two generations.	2022	05	04	Sci Total Environ	Nguyen	Hoa Thanh
35218741	10.1016/j.bcp.2022.114977	Post-translational modification of MALT1 and its role in B cell- and T cell-related diseases.	Mucosa-associated lymphoid tissue lymphoma translocation protein 1 (MALT1) is a multifunctional protein. MALT1 functions as an adaptor protein to assemble and recruit proteins such as B-cell lymphoma 10 (BCL10) and caspase-recruitment domain (CARD)-containing coiled-coil protein 11 (CARD11). Conversely it also acts as a paracaspase to cleave specified substrates. Because of its involvement in immunity, inflammation and cancer through its dual functions of scaffolding and catalytic activity, MALT1 is becoming a promising therapeutic target in B cell- and T cell-related diseases. There is growing evidence that the function of MALT1 is subtly modulated via post-translational modifications. This review summarized recent progress in relevant studies regarding the physiological and pathophysiological functions of MALT1, post-translational modifications of MALT1 and its role in B cell- and T cell- related diseases. In addition, the current available MALT1 inhibitors were also discussed.	2022	04	25	Biochem Pharmacol	Zhang	Yi-Yue
35230873	10.1126/scisignal.abk3083	Phosphorylation of serine-893 in CARD11 suppresses the formation and activity of the CARD11-BCL10-MALT1 complex in T and B cells.	CARD11 acts as a gatekeeper for adaptive immune responses after T cell or B cell antigen receptor (TCR/BCR) ligation on lymphocytes. PKCθ/β-catalyzed phosphorylation of CARD11 promotes the assembly of the CARD11-BCL10-MALT1 (CBM) complex and lymphocyte activation. Here, we demonstrated that PKCθ/β-dependent CARD11 phosphorylation also suppressed CARD11 functions in T or B cells. Through mass spectrometry-based proteomics analysis, we identified multiple constitutive and inducible CARD11 phosphorylation sites in T cells. We demonstrated that a single TCR- or BCR-inducible phosphorylation on Ser<sup>893</sup> in the carboxyl terminus of CARD11 prevented the activation of the transcription factor NF-κB, the kinase JNK, and the protease MALT1. Moreover, CARD11 Ser<sup>893</sup> phosphorylation sensitized BCR-addicted lymphoma cells to toxicity induced by Bruton's tyrosine kinase (BTK) inhibitors. Phosphorylation of Ser<sup>893</sup> in CARD11 by PKCθ controlled the strength of CARD11 scaffolding by impairing the formation of the CBM complex. Thus, PKCθ simultaneously catalyzes both stimulatory and inhibitory CARD11 phosphorylation events, which shape the strength of CARD11 signaling in lymphocytes.	2022	03	31	Sci Signal	Kutzner	Kerstin
35255409	10.1016/j.jbior.2022.100890	CARD11 signaling in regulatory T cell development and function.	Regulatory T cells (Tregs) are a critical subset of CD4 T cells that modulate the immune response to prevent autoimmunity and chronic inflammation. CARD11, a signaling hub and scaffold protein that links antigen receptor engagement to activation of NF-κB and other downstream signaling pathways, is essential for the development and function of thymic Tregs. Mouse models with deficiencies in CARD11 and CARD11-associated signaling components generally have Treg defects, but some mouse models develop overt autoimmunity and inflammatory disease whereas others do not. Inhibition of CARD11 signaling in Tregs within the tumor microenvironment can potentially promote anti-tumor immunity. In this review, we summarize evidence for the involvement of CARD11 signaling in Treg development and function and discuss key unanswered questions and future research opportunities.	2022	05	30	Adv Biol Regul	Carter	Nicole M
35406516	10.3390/cancers14071742	Extranodal Marginal Zone Lymphoma: Pathogenesis, Diagnosis and Treatment.	Extranodal Marginal Zone Lymphoma (EMZL lymphoma) is an indolent B-cell lymphoma with a median age at diagnosis of about 60 years. It accounts for 7-8% of all B-cell lymphomas. It can occur in various extranodal sites, including stomach, lung, ocular adnexa, and skin; furthermore, the disseminated disease can be found in 25-50% of cases. Several infectious agents, such as <i>Helicobacter pylori</i> (<i>H. Pylori</i>) in the case of gastric Mucosa Associated Lymphoid Tissue (MALT) Lymphoma, can drive the pathogenesis of this cancer, through the autoantigenic stimulation of T cells, but there may also be other factors participating such autoimmune diseases. Initial staging should include total body computed tomography, bone marrow aspirate, and endoscopic investigation if indicated. Fluorescence in situ hybridization (FISH), should be performed to detect the presence of specific chromosomal translocations involving the <i>MALT1</i> and <i>BCL10</i> genes, which leads to the activation of the <i>NF-κB</i> signaling pathway. Depending on the location and dissemination of the disease, different therapeutic choices may include targeted therapy against the etiopathogenetic agent, radiotherapy, immunochemotherapy, and biological drugs. The purpose of this review is to illustrate the complex biology and the diagnosis of this disease and to better define new treatment strategies.	2022	04	15	Cancers (Basel)	Di Rocco	Alice
35411950	10.1002/cbf.3702	USP7 sustains an active epigenetic program via stabilizing MLL2 and WDR5 in diffuse large B-cell lymphoma.	Activated B-cell-like (ABC)-diffuse large B-cell lymphoma (ABC-DLBCL) is a common subtype of non-Hodgkin's lymphoma with poor prognosis. The survival of ABC-DLBCL relies on constitutive activation of BCR signaling, but the underlying molecular mechanism is not fully addressed. By mining The Cancer Genome Atlas database, we found that the expression of ubiquitin-specific protease 7 (USP7) is significantly elevated in three cancer types including DLBCL. Interestingly, unlike germinal center B-cell-like (GCB)-DLBCL, ABC-DLBCL shows upregulated expression of USP7. Inhibiting the enzymatic activity of USP7 (P22077) has a drastic effect on ABC-DLBCL, but not GCB-DLBCL cells. Compared to GCB-DLBCL, ABC-DLBCL cells show transcriptional upregulation of multiple components of BCR-signaling. USP7 inhibition significantly reduces the expression of upregulated components of BCR signaling. Mechanistically, USP7 inhibition greatly reduces the methylation of histone 3 on lysine 4 (H3K4me2), which is an epigenetic marker for active enhancers. USP7 inhibition greatly reduces the protein level of WDR5 and MLL2, key components of lysine-specific methyltransferase complex (complex of proteins associated with Set1 [COMPASS]). In ABC-DLBCL cells, USP7 stabilizes WDR5 and MLL2. In patients, the expression of USP7 is significantly associated with components of BCR signaling (LYN, SYK, BTK, PLCG2, PRKCB, MALT1, BCL10, and CARD11) and targets of BCR signaling (MYC and IRF4). In summary, we demonstrated an essential role of USP7 in ABC-DLBCL by organizing an oncogenic epigenetic program via stabilization of WDR5 and MLL2. Targeting USP7 might be a novel and efficient approach to treat patients with ABC-DLBCL and it might be better than targeting individual components such as BTK in BCR signaling.	2022	06	09	Cell Biochem Funct	Wu	Yuanyuan
35540095	10.1016/j.jacbts.2022.02.004	CARD9-Mediated Signaling and Cardiovascular Diseases.	NA	2022	05	17	JACC Basic Transl Sci	Liu	Xuanyou
35600392	10.3389/fonc.2022.881801	SOCS3 Acts as an Onco-immunological Biomarker With Value in Assessing the Tumor Microenvironment, Pathological Staging, Histological Subtypes, Therapeutic Effect, and Prognoses of Several Types of Cancer.	The suppressor of cytokine signaling (<i>SOCS</i>) family contains eight members, including <i>SOCS1-7</i> and <i>CIS</i>, and <i>SOCS3</i> has been shown to inhibit cytokine signal transduction in various signaling pathways. Although several studies have currently shown the correlations between <i>SOCS3</i> and several types of cancer, no pan-cancer analysis is available to date. We used various computational tools to explore the expression and pathogenic roles of <i>SOCS3</i> in several types of cancer, assessing its potential role in the pathogenesis of cancer, in tumor immune infiltration, tumor progression, immune evasion, therapeutic response, and prognostic. The results showed that <i>SOCS3</i> was downregulated in most The Cancer Genome Atlas (TCGA) cancer datasets but was highly expressed in brain tumors, breast cancer, esophageal cancer, colorectal cancer, and lymphoma. High <i>SOCS3</i> expression in glioblastoma multiforme (GBM) and brain lower-grade glioma (LGG) were verified through immunohistochemical experiments. GEPIA and Kaplan-Meier Plotter were used, and this bioinformatics analysis showed that high <i>SOCS3</i> expression was associated with a poor prognosis in the majority of cancers, including LGG and GBM. Our analysis also indicated that <i>SOCS3</i> may be involved in tumor immune evasion <i>via</i> immune cell infiltration or T-cell exclusion across different types of cancer. In addition, <i>SOCS3</i> methylation was negatively correlated with <i>mRNA</i> expression levels, worse prognoses, and dysfunctional T-cell phenotypes in various types of cancer. Next, different analytical methods were used to select genes related to <i>SOCS3</i> gene alterations and carcinogenic characteristics, such as <i>STAT3</i>, <i>SNAI1</i>, <i>NFKBIA</i>, <i>BCL10</i>, <i>TK1</i>, <i>PGS1</i>, <i>BIRC5</i>, <i>TMC8</i>, and <i>AFMID</i>, and several biological functions were identified between them. We found that <i>SOCS3</i> was involved in cancer development primarily through the <i>JAK/STAT</i> signaling pathway and cytokine receptor activity. Furthermore, <i>SOCS3</i> expression levels were associated with immunotherapy or chemotherapy for numerous types of cancer. In conclusion, this study showed that <i>SOCS3</i> is an immune-oncogenic molecule that may possess value as a biomarker for diagnosis, treatment, and prognosis of several types of cancer in the future.	2022	07	16	Front Oncol	Dai	Lirui
35658124	10.1158/2159-8290.CD-21-1566	BCL10 Mutations Define Distinct Dependencies Guiding Precision Therapy for DLBCL.	Activated B cell-like diffuse large B-cell lymphomas (ABC-DLBCL) have unfavorable outcomes and chronic activation of CARD11-BCL10-MALT1 (CBM) signal amplification complexes that form due to polymerization of BCL10 subunits, which is affected by recurrent somatic mutations in ABC-DLBCLs. Herein, we show that BCL10 mutants fall into at least two functionally distinct classes: missense mutations of the BCL10 CARD domain and truncation of its C-terminal tail. Truncating mutations abrogated a motif through which MALT1 inhibits BCL10 polymerization, trapping MALT1 in its activated filament-bound state. CARD missense mutations enhanced BCL10 filament formation, forming glutamine network structures that stabilize BCL10 filaments. Mutant forms of BCL10 were less dependent on upstream CARD11 activation and thus manifested resistance to BTK inhibitors, whereas BCL10 truncating but not CARD mutants were hypersensitive to MALT1 inhibitors. Therefore, BCL10 mutations are potential biomarkers for BTK inhibitor resistance in ABC-DLBCL, and further precision can be achieved by selecting therapy based on specific biochemical effects of distinct mutation classes. ABC-DLBCLs feature frequent mutations of signaling mediators that converge on the CBM complex. We use structure-function approaches to reveal that BCL10 mutations fall into two distinct biochemical classes. Both classes confer resistance to BTK inhibitors, whereas BCL10 truncations confer hyperresponsiveness to MALT1 inhibitors, providing a road map for precision therapies in ABC-DLBCLs. See related commentary by Phelan and Oellerich, p. 1844. This article is highlighted in the In This Issue feature, p. 1825.	2022	08	08	Cancer Discov	Xia	Min
35727133	10.7554/eLife.79826	A nucleation barrier spring-loads the CBM signalosome for binary activation.	Immune cells activate in binary, switch-like fashion via large protein assemblies known as signalosomes, but the molecular mechanism of the switch is not yet understood. Here, we employed an in-cell biophysical approach to dissect the assembly mechanism of the CARD-BCL10-MALT1 (CBM) signalosome, which governs nuclear transcription factor-κB activation in both innate and adaptive immunity. We found that the switch consists of a sequence-encoded and deeply conserved nucleation barrier to ordered polymerization by the adaptor protein BCL10. The particular structure of the BCL10 polymers did not matter for activity. Using optogenetic tools and single-cell transcriptional reporters, we discovered that endogenous BCL10 is functionally supersaturated even in unstimulated human cells, and this results in a predetermined response to stimulation upon nucleation by activated CARD multimers. Our findings may inform on the progressive nature of age-associated inflammation, and suggest that signalosome structure has evolved via selection for kinetic rather than equilibrium properties of the proteins. The innate immune system is the body’s first line of defence against pathogens. Although innate immune cells do not recognize specific disease-causing agents, they can detect extremely low levels of harmful organisms or substances. In response, they activate signals that lead to inflammation, which tells other cells that there is an infection. Innate immune cells are turned on in a switch-like fashion, becoming active very quickly after interacting with a pathogen. This is due to the action of signalosomes, large complexes made up of several proteins that clump together to form long chains that activate the cell. But how do these large protein complexes assemble quick enough to create the switch-like activation observed in innate immune cells? To answer this question, Rodríguez Gama et al. focused on the CBM signalosome, which is involved in triggering inflammation through the activation of a protein called NF-kB. First, Rodríguez Gama et al. used genetic tools to determine that activating the CBM signalosome drives a switch-like activation of NF-kB in cells. This means that individual cells in a population either become fully activated or not at all in response to minute amounts of harmful substances. Once they had established this, Rodríguez Gama et al. wanted to know which protein in the CBM signalosome was responsible for the switch. They found that one of the proteins in the signalosome, called BCL10, has a ‘nucleation barrier’ encoded in its sequence. This means that it is very hard for BCL10 to start clumping together, but once it does, the clumps grow on their own. The nucleation barrier describes exactly how hard it is for these clumps to get started, and is determined by how disorganized the protein is. When a pathogen ‘stimulates’ an immune cell, a tiny template is formed that lowers the nucleation barrier so that BCL10 can then aggregate itself together, leading to the switch-like behaviour observed. The nucleation barrier allows there to be more than enough BCL10 present in the cell at all times – ready to clump together at a moment’s notice – and this permits the cell to detect very low levels of a pathogen. Rodríguez Gama et al. then tested whether BCL10 from other animals also has a nucleation barrier. They found that this feature is conserved from cnidarians, such as corals or jellyfish, to mammals, including humans. This suggests that the use of nucleation barriers to regulate innate immune signalling has existed for a long time throughout evolution. The work by Rodríguez Gama et al. broadens our understanding of how the innate immune system senses and responds to extremely low levels of pathogens. That BCL10 is always ready to clump together suggests it may be a driving force for chronic and age-associated inflammation. Additionally, the findings of Rodríguez Gama et al. also offer insights into how other signalosomes may become activated, and offer the possibility of new drugs aimed at modifying nucleation barriers.	2022	08	03	Elife	Rodriguez Gama	Alejandro
