pmid	doi	year	title	Hugo_Symbol
33050534	10.3390/cancers12102913	2020	Oncogenic Mutations of MYD88 and CD79B in Diffuse Large B-Cell Lymphoma and Implications for Clinical Practice.	BCR
33067949	10.19746/j.cnki.issn.1009-2137.2020.05.017	2020	[Analysis of Clinical Characteristics in De novo Chronic Myelogenous Leukemia Patients with Extramedullary T-Lymphoblastic Blast Crisis].	BCR
33091668	10.1016/j.bioorg.2020.104377	2020	HZ-A-005, a potent, selective, and covalent Bruton's tyrosine kinase inhibitor in preclinical development.	BCR
33093447	10.1038/s41467-020-18998-1	2020	Targeting N-myristoylation for therapy of B-cell lymphomas.	BCR
33093947	10.12688/f1000research.22318.1	2020	ACCEPT - combining acalabrutinib with rituximab, cyclophosphamide, doxorubicin, vincristine and prednisolone (R-CHOP) for Diffuse Large B-cell Lymphoma (DLBCL): study protocol for a Phase Ib/II open-label non-randomised clinical trial.	BCR
33122918	10.2147/OTT.S275334	2020	Genotyping on ctDNA Identifies Shifts in Mutation Spectrum Between Newly Diagnosed and Relapse/Refractory DLBCL.	BCR
33149299	10.1038/s41586-020-2884-6	2020	IFITM3 functions as a PIP3 scaffold to amplify PI3K signalling in B cells.	BCR
33154951	10.3389/fonc.2020.591577	2020	Genetic and Non-Genetic Mechanisms of Resistance to BCR Signaling Inhibitors in B Cell Malignancies.	BCR
33157925	10.1097/MD.0000000000022791	2020	Dasatinib associated lymphadenopathy in a chronic myeloid leukemia patient: A case report.	BCR
33194070	NA	2020	Evaluation of the clinicopathologic features of diffuse large B cell lymphoma after CD19-targeted CAR T-cell therapy emphasizing the potential diagnostic pitfalls.	BCR
33207194	10.1016/j.celrep.2020.108403	2020	Cyclin D3 Governs Clonal Expansion of Dark Zone Germinal Center B Cells.	BCR
33230098	10.1038/s41408-020-00388-x	2020	Venetoclax-based chemotherapy in acute and chronic myeloid neoplasms: literature survey and practice points.	BCR
33282736	10.3389/fonc.2020.580364	2020	Integration of the B-Cell Receptor Antigen Neurabin-I/SAMD14 Into an Antibody Format as New Therapeutic Approach for the Treatment of Primary CNS Lymphoma.	BCR
33323828	10.1097/CM9.0000000000001294	2020	R-CHOP resistance in diffuse large B-cell lymphoma: biological and molecular mechanisms.	BCR
33324393	10.3389/fimmu.2020.560244	2020	Specific Targeting of Lymphoma Cells Using Semisynthetic Anti-Idiotype Shark Antibodies.	BCR
33363034	10.3389/fonc.2020.604685	2020	Role of Specific B-Cell Receptor Antigens in Lymphomagenesis.	BCR
33552960	10.3389/fonc.2020.584149	2020	Case Report: A Case With Philadelphia Chromosome Positive T-Cell Lymphoblastic Lymphoma and a Review of Literature.	BCR
23171834	10.1159/000341289	2013	A case of 8p11 myeloproliferative syndrome with BCR-FGFR1 gene fusion presenting with trilineage acute leukemia/lymphoma, successfully treated by cord blood transplantation.	BCR
22231445	10.1038/onc.2011.604	2012	STAP-2 interacts with and modulates BCR-ABL-mediated tumorigenesis.	BCR
11069024	10.1038/sj.leu.2401923	2000	Cytoplasmic and nuclear localization of the 130 and 160 kDa Bcr proteins.	BCR
