pmid	doi	year	title	Hugo_Symbol
29472356	10.3324/haematol.2017.184325	2018	A B-cell receptor-related gene signature predicts survival in mantle cell lymphoma: results from the Fondazione Italiana Linfomi MCL-0208 trial.	BTK
29476222	10.1007/s00280-018-3546-3	2018	Ibrutinib brain distribution: a preclinical study.	BTK
29483220	10.1158/1535-7163.MCT-17-0784	2018	p110α Inhibition Overcomes Stromal Cell-Mediated Ibrutinib Resistance in Mantle Cell Lymphoma.	BTK
29483358	10.4049/jimmunol.1701489	2018	Bruton's Tyrosine Kinase Is Not Essential for B Cell Survival beyond Early Developmental Stages.	BTK
29484684	10.1002/hon.2502	2018	Clinical, pathological, and biological characterization of Richter syndrome developing after ibrutinib treatment for relapsed chronic lymphocytic leukemia.	BTK
29496671	10.1182/blood-2017-10-811752	2018	BTK<sup>Cys481Ser</sup> drives ibrutinib resistance via ERK1/2 and protects BTK<sup>wild-type</sup> MYD88-mutated cells by a paracrine mechanism.	BTK
29532266	10.1007/s10753-018-0745-3	2018	Ibrutinib Exacerbates Bleomycin-Induced Pulmonary Fibrosis via Promoting Inflammation.	BTK
29549872	10.1016/j.ctrv.2018.01.002	2018	Targeting the B-cell receptor pathway in diffuse large B-cell lymphoma.	BTK
29560128	10.18632/oncotarget.24310	2018	First-in-human phase 1 study of the BTK inhibitor GDC-0853 in relapsed or refractory B-cell NHL and CLL.	BTK
29567799	10.1182/blood-2017-10-809210	2018	Pan-SRC kinase inhibition blocks B-cell receptor oncogenic signaling in non-Hodgkin lymphoma.	BTK
29590547	10.1056/NEJMoa1715519	2018	Ibrutinib plus Venetoclax for the Treatment of Mantle-Cell Lymphoma.	BTK
29615403	10.1182/blood-2018-02-832535	2018	SOX11 augments BCR signaling to drive MCL-like tumor development.	BTK
29652138	10.1021/acs.bioconjchem.8b00137	2018	Development of a Selective Labeling Probe for Bruton's Tyrosine Kinase Quantification in Live Cells.	BTK
29669753	10.1182/bloodadvances.2017011916	2018	Pilot trial of ibrutinib in patients with relapsed or refractory T-cell lymphoma.	BTK
29690649	10.3390/cancers10040127	2018	Responses to the Selective Bruton's Tyrosine Kinase (BTK) Inhibitor Tirabrutinib (ONO/GS-4059) in Diffuse Large B-cell Lymphoma Cell Lines.	BTK
29712895	10.1038/s41408-018-0076-5	2018	Waldenström macroglobulinemia treatment algorithm 2018.	BTK
29721381	10.1080/2162402X.2017.1423183	2018	FOXO1 promotes resistance of non-Hodgkin lymphomas to anti-CD20-based therapy.	BTK
29725548	10.1155/2018/5471368	2018	A Case Report of Nongerminal Center B-Cell Type Diffuse Large B-Cell Lymphoma Treated to Complete Response with Rituximab and Ibrutinib.	BTK
29735551	10.1158/0008-5472.CAN-17-4004	2018	Novel Richter Syndrome Xenograft Models to Study Genetic Architecture, Biology, and Therapy Responses.	BTK
29737219	10.1080/17474086.2018.1473030	2018	Use of acalabrutinib in patients with mantle cell lymphoma.	BTK
29741794	10.1002/ardp.201700369	2018	Targeting Bruton's tyrosine kinase for the treatment of B cell associated malignancies and autoimmune diseases: Preclinical and clinical developments of small molecule inhibitors.	BTK
29768934	10.1080/14740338.2018.1477936	2018	A safety profile of medications used to treat Waldenström's macroglobulinemia.	BTK
29781323	10.1080/14728214.2018.1479396	2018	Targeting the B-cell receptor pathway: a review of current and future therapies for non-Hodgkin's lymphoma.	BTK
29785709	10.1111/bjh.15411	2018	Four-year follow-up of a single arm, phase II clinical trial of ibrutinib with rituximab (IR) in patients with relapsed/refractory mantle cell lymphoma (MCL).	BTK
29808236	10.1007/s11864-018-0548-7	2018	Pitfalls of Combining Novel Agents in Lymphoma.	BTK
29855199	10.1080/13543784.2018.1482273	2018	Targeting the B cell receptor pathway in non-Hodgkin lymphoma.	BTK
29861875	10.18632/oncotarget.25011	2018	The B cell receptor signaling pathway in mantle cell lymphoma.	BTK
29873072	10.1111/bjh.15421	2018	Evaluation of 230 patients with relapsed/refractory deletion 17p chronic lymphocytic leukaemia treated with ibrutinib from 3 clinical trials.	BTK
29899297	10.3390/ijms19061758	2018	Molecular Mechanisms of Disease Progression in Primary Cutaneous Diffuse Large B-Cell Lymphoma, Leg Type during Ibrutinib Therapy.	BTK
29912596	10.1080/10428194.2018.1457148	2018	Understanding resistance mechanisms to BTK and BCL2 inhibitors in mantle cell lymphoma: implications for design of clinical trials.	BTK
29925955	10.1038/s41586-018-0290-0	2018	A multiprotein supercomplex controlling oncogenic signalling in lymphoma.	BTK
30006143	10.1016/j.bmc.2018.07.007	2018	Novel amino acid-substituted diphenylpyrimidine derivatives as potent BTK inhibitors against B cell lymphoma cell lines.	BTK
30011241	10.1177/2472555218786165	2018	Homogeneous BTK Occupancy Assay for Pharmacodynamic Assessment of Tirabrutinib (GS-4059/ONO-4059) Target Engagement.	BTK
30052472	10.1080/17474086.2018.1506327	2018	New and emerging Bruton tyrosine kinase inhibitors for treating mantle cell lymphoma - where do they fit in?	BTK
30069629	10.1007/978-3-319-91439-8_7	2018	Ibrutinib.	BTK
30077608	10.1016/j.bmc.2018.07.047	2018	Design and synthesis of benzofuro[3,2-b]pyridin-2(1H)-one derivatives as anti-leukemia agents by inhibiting Btk and PI3Kδ.	BTK
30104685	10.1038/s41598-018-30509-3	2018	Drug-based perturbation screen uncovers synergistic drug combinations in Burkitt lymphoma.	BTK
30115641	10.1182/bloodadvances.2018016048	2018	Activation of MYC, a bona fide client of HSP90, contributes to intrinsic ibrutinib resistance in mantle cell lymphoma.	BTK
30175400	10.1111/bjh.15567	2018	Long-term outcomes and mutation profiling of patients with mantle cell lymphoma (MCL) who discontinued ibrutinib.	BTK
30190023	10.1016/j.hoc.2018.05.012	2018	First-Generation and Second-Generation Bruton Tyrosine Kinase Inhibitors in Waldenström Macroglobulinemia.	BTK
30209121	10.1182/blood-2018-03-841015	2018	B-cell receptor-mediated NFATc1 activation induces IL-10/STAT3/PD-L1 signaling in diffuse large B-cell lymphoma.	BTK
30231317	10.1200/EDBK_200829	2018	Treatment of Primary Central Nervous System Lymphoma: From Chemotherapy to Small Molecules.	BTK
30280589	10.1080/1062936X.2018.1518927	2018	Molecular modelling studies on cinnoline-based BTK inhibitors using docking and structure-based 3D-QSAR.	BTK
30305939	10.1136/esmoopen-2018-000387	2018	BET bromodomain inhibitor birabresib in mantle cell lymphoma: in vivo activity and identification of novel combinations to overcome adaptive resistance.	BTK
30390220	10.1007/s40265-018-1003-6	2018	Targeting Bruton's Tyrosine Kinase Across B-Cell Malignancies.	BTK
30401751	10.1182/bloodadvances.2018022962	2018	Insights into the genomic landscape of MYD88 wild-type Waldenström macroglobulinemia.	BTK
30510142	10.1158/1535-7163.MCT-17-0789-ATR	2018	XPO1 Inhibitor Selinexor Overcomes Intrinsic Ibrutinib Resistance in Mantle Cell Lymphoma via Nuclear Retention of IκB.	BTK
30534553	10.1155/2018/1042597	2018	Bone Marrow Molecular Markers Associated with Relapsed/Refractory Activated B-Cell-Like Diffuse Large B-Cell Lymphoma.	BTK
28428442	10.1158/1535-7163.MCT-16-0555	2017	Combination of Ibrutinib and ABT-199 in Diffuse Large B-Cell Lymphoma and Follicular Lymphoma.	BTK
26961147	10.1093/annonc/mdw131	2016	Combination of the MEK inhibitor pimasertib with BTK or PI3K-delta inhibitors is active in preclinical models of aggressive lymphomas.	BTK
27157620	10.1038/onc.2016.155	2016	FBXO10 deficiency and BTK activation upregulate BCL2 expression in mantle cell lymphoma.	BTK
25189416	10.1038/leu.2014.263	2015	Functional characterization of BTK(C481S) mutation that confers ibrutinib resistance: exploration of alternative kinase inhibitors.	BTK
25433814	10.1007/s00428-014-1698-z	2015	Bruton's tyrosine kinase (Btk) is a useful marker for Hodgkin and B cell non-Hodgkin lymphoma.	BTK
25944695	10.18632/oncotarget.3824	2015	Irreversible dual inhibitory mode: the novel Btk inhibitor PLS-123 demonstrates promising anti-tumor activity in human B-cell lymphoma.	BTK
26540570	10.18632/oncotarget.6273	2015	Combinatorial BTK and MALT1 inhibition augments killing of CD79 mutant diffuse large B cell lymphoma.	BTK
24658273	10.1038/nrc3702	2014	Targeting Bruton's tyrosine kinase in B cell malignancies.	BTK
24970801	10.18632/oncotarget.2071	2014	Synergistic induction of apoptosis by combination of BTK and dual mTORC1/2 inhibitors in diffuse large B cell lymphoma.	BTK
18241233	10.1111/j.1365-2249.2008.03589.x	2008	Naturally occurring Bruton's tyrosine kinase mutations have no dominant negative effect in an X-linked agammaglobulinaemia cellular model.	BTK
11920564	10.1002/1521-4141(200204)32:4&lt;982::AID-IMMU982&gt;3.0.CO;2-I	2002	Expression profiling in transformed human B cells: influence of Btk mutations and comparison to B cell lymphomas using filter and oligonucleotide arrays.	BTK
8688094	10.1126/science.273.5278.1096	1996	BTK as a mediator of radiation-induced apoptosis in DT-40 lymphoma B cells.	BTK
8283037	NA	1994	Expression of Bruton's agammaglobulinemia tyrosine kinase gene, BTK, is selectively down-regulated in T lymphocytes and plasma cells.	BTK
