pmid	doi	year	title	Hugo_Symbol
17079483	10.1158/0008-5472.CAN-06-1981	2006	Eradication of tumor colonization and invasion by a B cell-specific immunotoxin in a murine model for human primary intraocular lymphoma.	CXCR4
15454484	10.1182/blood-2004-03-0799	2005	Chemokine receptor expression in EBV-associated lymphoproliferation in hu/SCID mice: implications for CXCL12/CXCR4 axis in lymphoma generation.	CXCR4
15833868	10.1158/0008-5472.CAN-04-4280	2005	Construction of a minimal HIV-1 variant that selectively replicates in leukemic derived T-cell lines: towards a new virotherapy approach.	CXCR4
16018941	10.1016/j.urolonc.2005.02.004	2005	Expression of the chemokine receptor CCR7 in prostate cancer presenting with generalized lymphadenopathy: report of a case, review of the literature, and analysis of chemokine receptor expression.	CXCR4
16038794	10.1016/j.cellsig.2004.12.009	2005	Heterologous regulation of chemokine receptor signaling by the lipid phosphatase SHIP in lymphocytes.	CXCR4
16080846	NA	2005	[The expression and clinical significance of stromal cell-derived factor-1 and CXCR4 in acute leukemia and malignant lymphoma].	CXCR4
16178723	10.2174/1389557054867075	2005	Potential clinical applications of the CXCR4 antagonist bicyclam AMD3100.	CXCR4
16211229	NA	2005	Overexpression of G protein-coupled receptors in cancer cells: involvement in tumor progression.	CXCR4
16269859	10.1159/000088410	2005	Role of CXCR4 chemokine receptor blockade using AMD3100 for mobilization of autologous hematopoietic progenitor cells.	CXCR4
16373702	10.1158/1535-7163.MCT-05-0146	2005	Transcript profiling in peripheral T-cell lymphoma, not otherwise specified, and diffuse large B-cell lymphoma identifies distinct tumor profile signatures.	CXCR4
11157475	10.1182/blood.v97.3.608	2001	SHP2 and cbl participate in alpha-chemokine receptor CXCR4-mediated signaling pathways.	CXCR4
