pmid	doi	title	Hugo_Symbol
33891562	10.18632/aging.202903	Age-related differences of genetic susceptibility to patients with acute lymphoblastic leukemia.	ARID5B
33788417	10.1002/pbc.29036	Novel risk factors for glucarpidase use in pediatric acute lymphoblastic leukemia: Hispanic ethnicity, age, and the ABCC4 gene.	ARID5B
32488880	10.1002/jcla.23414	Association of TLX1 gene polymorphisms with the risk of acute lymphoblastic leukemia and B lineage acute lymphoblastic leukemia in Han Chinese children.	ARID5B
31870219	10.1080/08880018.2019.1705949	Association of <i>ABCC2</i> with levels and toxicity of methotrexate in Malaysian Childhood Acute Lymphoblastic Leukemia (ALL).	ARID5B
31800539	10.1097/JCMA.0000000000000198	Reply to ""ARID5B rs7089424 and rs10994982 and association with B-lineage ALL susceptibility"".	ARID5B
31800538	10.1097/JCMA.0000000000000197	ARID5B rs7089424 and rs10994982 and association with B-lineage ALL susceptibility.	ARID5B
31704777	10.1136/jmedgenet-2019-106339	Novel phenotypes observed in patients with <i>ETV6</i>-linked leukaemia/familial thrombocytopenia syndrome and a biallelic <i>ARID5B</i> risk allele as leukaemogenic cofactor.	ARID5B
31573954	10.1158/1078-0432.CCR-19-0190	<i>ARID5B</i> Influences Antimetabolite Drug Sensitivity and Prognosis of Acute Lymphoblastic Leukemia.	ARID5B
31424309	10.1080/08880018.2019.1649333	<i>ARID5B</i> rs10821936 and rs10994982 gene polymorphisms and acute lymphoblastic leukemia: relation to disease susceptibility and outcome.	ARID5B
31350265	10.1182/blood.2018890764	Inherited genetic susceptibility to acute lymphoblastic leukemia in Down syndrome.	ARID5B
31274788	10.1097/JCMA.0000000000000038	Genetic polymorphisms of ARID5B rs7089424 and rs10994982 are associated with B-lineage ALL susceptibility in Chinese pediatric population.	ARID5B
31227872	10.1007/s00277-019-03730-x	Variants in ARID5B gene are associated with the development of acute lymphoblastic leukemia in Mexican children.	ARID5B
31221981	10.1038/s12276-019-0230-6	The cancer driver genes IDH1/2, JARID1C/ KDM5C, and UTX/ KDM6A: crosstalk between histone demethylation and hypoxic reprogramming in cancer metabolism.	ARID5B
31111395	10.1007/s12185-019-02658-2	ARID5B gene polymorphisms and the risk of childhood acute lymphoblastic leukemia: a meta-analysis.	ARID5B
31076442	10.1182/blood.2018874503	The enhancer RNA <i>ARIEL</i> activates the oncogenic transcriptional program in T-cell acute lymphoblastic leukemia.	ARID5B
30810385	10.1089/gtmb.2018.0283	Association of ARID5B and IKZF1 Variants with Leukemia from Northern India.	ARID5B
30770347	10.1158/1055-9965.EPI-18-0801	Is There Etiologic Heterogeneity between Subtypes of Childhood Acute Lymphoblastic Leukemia? A Review of Variation in Risk by Subtype.	ARID5B
29654272	10.1038/s41375-018-0110-4	Identification of novel lncRNAs regulated by the TAL1 complex in T-cell acute lymphoblastic leukemia.	ARID5B
29504848	10.1080/08916934.2018.1446525	Signalling pathways identified in salivary glands from primary Sjögren's syndrome patients reveal enhanced adipose tissue development.	ARID5B
29335448	10.1038/s41598-017-19127-7	Regional evaluation of childhood acute lymphoblastic leukemia genetic susceptibility loci among Japanese.	ARID5B
29326336	10.1101/gad.302646.117	ARID5B as a critical downstream target of the TAL1 complex that activates the oncogenic transcriptional program and promotes T-cell leukemogenesis.	ARID5B
28905228	10.1007/s12032-017-1038-7	Genetic susceptibility in childhood acute lymphoblastic leukemia.	ARID5B
28817678	10.1371/journal.pone.0180488	Family-based exome-wide association study of childhood acute lymphoblastic leukemia among Hispanics confirms role of ARID5B in susceptibility.	ARID5B
28751478	10.1158/1055-9965.EPI-17-0360	Novel Gene and Network Associations Found for Acute Lymphoblastic Leukemia Using Case-Control and Family-Based Studies in Multiethnic Populations.	ARID5B
28476190	10.1016/j.arcmed.2016.12.003	ARID5B, CEBPE and PIP4K2A Germline Genetic Polymorphisms and Risk of Childhood Acute Lymphoblastic Leukemia in Mexican Patients: A MIGICCL Study.	ARID5B
28381164	10.1177/1010428317697573	Association of ARID5B gene variants with acute lymphoblastic leukemia in Yemeni children.	ARID5B
28256501	10.1038/ncomms14616	Genetic and regulatory mechanism of susceptibility to high-hyperdiploid acute lymphoblastic leukaemia at 10p21.2.	ARID5B
27644650		Association of Genetic Variants in ARID5B, IKZF1 and CEBPE with Risk of Childhood de novo B-Lineage Acute Lymphoblastic Leukemia in India.	ARID5B
27184773	10.3109/08880018.2016.1161685	Association of genetic variation in IKZF1, ARID5B, CDKN2A, and CEBPE with the risk of acute lymphoblastic leukemia in Tunisian children and their contribution to racial differences in leukemia incidence.	ARID5B
26941364	10.1158/1055-9965.EPI-15-0528	Pathway Analysis of Genome-wide Association Study in Childhood Leukemia among Hispanics.	ARID5B
26575185	10.1371/journal.pone.0143343	Somatic Mutation Allelic Ratio Test Using ddPCR (SMART-ddPCR): An Accurate Method for Assessment of Preferential Allelic Imbalance in Tumor DNA.	ARID5B
26104880	10.1038/ncomms8553	Inherited coding variants at the CDKN2A locus influence susceptibility to acute lymphoblastic leukaemia in children.	ARID5B
25806972	10.1371/journal.pone.0121348	ARID5B, IKZF1 and non-genetic factors in the etiology of childhood acute lymphoblastic leukemia: the ESCALE study.	ARID5B
25761407	10.1007/s10552-015-0550-3	Association of genetic variation in IKZF1, ARID5B, and CEBPE and surrogates for early-life infections with the risk of acute lymphoblastic leukemia in Hispanic children.	ARID5B
25310577	10.1371/journal.pone.0110255	Confirmation of childhood acute lymphoblastic leukemia variants, ARID5B and IKZF1, and interaction with parental environmental exposures.	ARID5B
25297793		Genomic evaluations of childhood acute lymphoblastic leukemia susceptibility across race/ethnicities.	ARID5B
25150625	10.1016/j.bcmd.2014.07.011	Concordant B-cell precursor acute lymphoblastic leukemia in non-twinned siblings.	ARID5B
25124600	10.7314/apjcp.2014.15.15.6211	Associations between AT-rich interactive domain 5B gene polymorphisms and risk of childhood acute lymphoblastic leukemia: a meta-analysis.	ARID5B
25096228	10.1159/000363660	A new system identification approach to identify genetic variants in sequencing studies for a binary phenotype.	ARID5B
25005032	10.3109/10428194.2014.933479	Childhood acute lymphoblastic leukemia-associated risk-loci IKZF1, ARID5B and CEBPE and risk of pediatric non-Hodgkin lymphoma: a report from the Berlin-Frankfurt-Münster Study Group.	ARID5B
24753091	10.1002/ajh.23727	Genomic ancestry and somatic alterations correlate with age at diagnosis in Hispanic children with B-cell acute lymphoblastic leukemia.	ARID5B
24712521	10.1111/bjh.12886	Associations of novel genetic variations in the folate-related and ARID5B genes with the pharmacokinetics and toxicity of high-dose methotrexate in paediatric acute lymphoblastic leukaemia.	ARID5B
24707947	10.3109/10428194.2014.910662	Genetic markers in a multi-ethnic sample for childhood acute lymphoblastic leukemia risk.	ARID5B
24497567	10.3324/haematol.2013.090720	Germline variants in IKZF1, ARID5B, and CEBPE as risk factors for adult-onset acute lymphoblastic leukemia: an analysis from the GMALL study group.	ARID5B
24200646	10.1016/j.bcmd.2013.10.003	High-resolution melting analyses for genetic variants in ARID5B and IKZF1 with childhood acute lymphoblastic leukemia susceptibility loci in Taiwan.	ARID5B
24013273	10.1007/s00432-013-1512-3	Intron 3 of the ARID5B gene: a hot spot for acute lymphoblastic leukemia susceptibility.	ARID5B
23975371	10.1007/s13277-013-1097-0	ARID5B gene rs10821936 polymorphism is associated with childhood acute lymphoblastic leukemia: a meta-analysis based on 39,116 subjects.	ARID5B
23836053	10.1007/s10552-013-0256-3	Genetic variants in ARID5B and CEBPE are childhood ALL susceptibility loci in Hispanics.	ARID5B
23692655	10.1016/j.leukres.2013.04.022	ARID5B and IKZF1 variants, selected demographic factors, and childhood acute lymphoblastic leukemia: a report from the Children's Oncology Group.	ARID5B
23608171	10.1016/j.gene.2013.04.028	Association of three polymorphisms in ARID5B, IKZF1 and CEBPE with the risk of childhood acute lymphoblastic leukemia in a Chinese population.	ARID5B
23512250	10.1093/jnci/djt042	Novel susceptibility variants at 10p12.31-12.2 for childhood acute lymphoblastic leukemia in ethnically diverse populations.	ARID5B
23114164		[Research advances on correlation of ARID5B gene with childhood acute lymphoblastic leukemia - review].	ARID5B
23021489	10.1186/1755-8794-5-42	Candidate gene association study in pediatric acute lymphoblastic leukemia evaluated by Bayesian network based Bayesian multilevel analysis of relevance.	ARID5B
23016962	10.1111/bjh.12063	Genetic polymorphisms in ARID5B, CEBPE, IKZF1 and CDKN2A in relation with risk of acute lymphoblastic leukaemia in adults: a Group for Research on Adult Acute Lymphoblastic Leukaemia (GRAALL) study.	ARID5B
22422485	10.1002/pbc.24131	Genetic variants modify susceptibility to leukemia in infants: a Children's Oncology Group report.	ARID5B
22291082	10.1200/JCO.2011.38.0345	ARID5B genetic polymorphisms contribute to racial disparities in the incidence and treatment outcome of childhood acute lymphoblastic leukemia.	ARID5B
21889209	10.1016/j.leukres.2011.07.034	Role of 657del5 NBN mutation and 7p12.2 (IKZF1), 9p21 (CDKN2A), 10q21.2 (ARID5B) and 14q11.2 (CEBPE) variation and risk of childhood ALL in the Polish population.	ARID5B
21098271	10.1073/pnas.1006981107	Genetic landscape of high hyperdiploid childhood acute lymphoblastic leukemia.	ARID5B
20538337	10.1016/j.leukres.2010.05.013	Genetic variation and the risk of acute lymphoblastic leukemia.	ARID5B
20460642	10.3324/haematol.2010.022459	Replication analysis confirms the association of ARID5B with childhood B-cell acute lymphoblastic leukemia.	ARID5B
20189245	10.1016/j.leukres.2010.02.001	Genome-wide association study of childhood acute lymphoblastic leukemia in Korea.	ARID5B
20054350	10.1038/leu.2009.277	ARID5B SNP rs10821936 is associated with risk of childhood acute lymphoblastic leukemia in blacks and contributes to racial differences in leukemia incidence.	ARID5B
20042726	10.1182/blood-2009-09-241513	Verification of the susceptibility loci on 7p12.2, 10q21.2, and 14q11.2 in precursor B-cell acute lymphoblastic leukemia of childhood.	ARID5B
19710713	10.1038/ng0909-957	Inherited susceptibility to pediatric acute lymphoblastic leukemia.	ARID5B
19684604	10.1038/ng.430	Loci on 7p12.2, 10q21.2 and 14q11.2 are associated with risk of childhood acute lymphoblastic leukemia.	ARID5B
19684603	10.1038/ng.432	Germline genomic variants associated with childhood acute lymphoblastic leukemia.	ARID5B
31704777	10.1136/jmedgenet-2019-106339	Novel phenotypes observed in patients with <i>ETV6</i>-linked leukaemia/familial thrombocytopenia syndrome and a biallelic <i>ARID5B</i> risk allele as leukaemogenic cofactor.	ARID5B
30810385	10.1089/gtmb.2018.0283	Association of ARID5B and IKZF1 Variants with Leukemia from Northern India.	ARID5B
28476190	10.1016/j.arcmed.2016.12.003	ARID5B, CEBPE and PIP4K2A Germline Genetic Polymorphisms and Risk of Childhood Acute Lymphoblastic Leukemia in Mexican Patients: A MIGICCL Study.	ARID5B
27644650		Association of Genetic Variants in ARID5B, IKZF1 and CEBPE with Risk of Childhood de novo B-Lineage Acute Lymphoblastic Leukemia in India.	ARID5B
27184773	10.3109/08880018.2016.1161685	Association of genetic variation in IKZF1, ARID5B, CDKN2A, and CEBPE with the risk of acute lymphoblastic leukemia in Tunisian children and their contribution to racial differences in leukemia incidence.	ARID5B
25806972	10.1371/journal.pone.0121348	ARID5B, IKZF1 and non-genetic factors in the etiology of childhood acute lymphoblastic leukemia: the ESCALE study.	ARID5B
25761407	10.1007/s10552-015-0550-3	Association of genetic variation in IKZF1, ARID5B, and CEBPE and surrogates for early-life infections with the risk of acute lymphoblastic leukemia in Hispanic children.	ARID5B
25310577	10.1371/journal.pone.0110255	Confirmation of childhood acute lymphoblastic leukemia variants, ARID5B and IKZF1, and interaction with parental environmental exposures.	ARID5B
25005032	10.3109/10428194.2014.933479	Childhood acute lymphoblastic leukemia-associated risk-loci IKZF1, ARID5B and CEBPE and risk of pediatric non-Hodgkin lymphoma: a report from the Berlin-Frankfurt-Münster Study Group.	ARID5B
24497567	10.3324/haematol.2013.090720	Germline variants in IKZF1, ARID5B, and CEBPE as risk factors for adult-onset acute lymphoblastic leukemia: an analysis from the GMALL study group.	ARID5B
23836053	10.1007/s10552-013-0256-3	Genetic variants in ARID5B and CEBPE are childhood ALL susceptibility loci in Hispanics.	ARID5B
23692655	10.1016/j.leukres.2013.04.022	ARID5B and IKZF1 variants, selected demographic factors, and childhood acute lymphoblastic leukemia: a report from the Children's Oncology Group.	ARID5B
23608171	10.1016/j.gene.2013.04.028	Association of three polymorphisms in ARID5B, IKZF1 and CEBPE with the risk of childhood acute lymphoblastic leukemia in a Chinese population.	ARID5B
23016962	10.1111/bjh.12063	Genetic polymorphisms in ARID5B, CEBPE, IKZF1 and CDKN2A in relation with risk of acute lymphoblastic leukaemia in adults: a Group for Research on Adult Acute Lymphoblastic Leukaemia (GRAALL) study.	ARID5B
22660188	10.1038/leu.2012.148	Genetic polymorphisms and childhood acute lymphoblastic leukemia: GWAS of the ESCALE study (SFCE).	ARID5B
21889209	10.1016/j.leukres.2011.07.034	Role of 657del5 NBN mutation and 7p12.2 (IKZF1), 9p21 (CDKN2A), 10q21.2 (ARID5B) and 14q11.2 (CEBPE) variation and risk of childhood ALL in the Polish population.	ARID5B
20042726	10.1182/blood-2009-09-241513	Verification of the susceptibility loci on 7p12.2, 10q21.2, and 14q11.2 in precursor B-cell acute lymphoblastic leukemia of childhood.	ARID5B
19684604	10.1038/ng.430	Loci on 7p12.2, 10q21.2 and 14q11.2 are associated with risk of childhood acute lymphoblastic leukemia.	ARID5B
29326336	10.1101/gad.302646.117	ARID5B as a critical downstream target of the TAL1 complex that activates the oncogenic transcriptional program and promotes T-cell leukemogenesis.	ARID5B
26104880	10.1038/ncomms8553	Inherited coding variants at the CDKN2A locus influence susceptibility to acute lymphoblastic leukaemia in children.	ARID5B
23996088	10.1182/blood-2013-03-491316	Variation at 10p12.2 and 10p14 influences risk of childhood B-cell acute lymphoblastic leukemia and phenotype.	ARID5B
23512250	10.1093/jnci/djt042	Novel susceptibility variants at 10p12.31-12.2 for childhood acute lymphoblastic leukemia in ethnically diverse populations.	ARID5B
23382691	10.1371/journal.pgen.1003225	Loci associated with N-glycosylation of human immunoglobulin G show pleiotropy with autoimmune diseases and haematological cancers.	ARID5B
22076464	10.1038/leu.2011.302	Identification of germline susceptibility loci in ETV6-RUNX1-rearranged childhood acute lymphoblastic leukemia.	ARID5B
19684603	10.1038/ng.432	Germline genomic variants associated with childhood acute lymphoblastic leukemia.	ARID5B
