pmid	doi	year	title	Hugo_Symbol
22531170	10.1097/PAS.0b013e3182549b50	2012	Application of a BRAF V600E mutation-specific antibody for the diagnosis of hairy cell leukemia.	BRAF
22639828	10.3109/10428194.2012.695777	2012	Absence of BRAF V600E mutation in hematologic malignancies excluding hairy-cell leukemia.	BRAF
23161722	10.1309/AJCP5TWORA0TMXGL	2012	Investigation of the BRAF V600E mutation by pyrosequencing in lymphoproliferative disorders.	BRAF
21625473	10.1371/journal.pone.0019861	2011	A novel requirement for Janus kinases as mediators of drug resistance induced by fibroblast growth factor-2 in human cancer cells.	BRAF
21663470	10.1056/NEJMoa1014209	2011	BRAF mutations in hairy-cell leukemia.	BRAF
19626635	10.1002/hed.21178	2010	Detectable BRAF mutation in serum DNA samples from patients with papillary thyroid carcinomas.	BRAF
19551857	10.1002/ijc.24681	2009	The mechanisms underlying MMR deficiency in immunodeficiency-related non-Hodgkin lymphomas are different from those in other sporadic microsatellite instable neoplasms.	BRAF
17483702	10.1097/MPH.0b013e3180547136	2007	Leukemia in Cardio-facio-cutaneous (CFC) syndrome: a patient with a germline mutation in BRAF proto-oncogene.	BRAF
17525723	10.1038/sj.leu.2404761	2007	The T1790A BRAF mutation (L597Q) in childhood acute lymphoblastic leukemia is a functional oncogene.	BRAF
15538400	10.1038/sj.leu.2403589	2005	Mutations in the BRAF and N-ras genes in childhood acute lymphoblastic leukaemia.	BRAF
15705790	10.1182/blood-2004-09-3683	2005	B-Raf-dependent expression of vascular endothelial growth factor-A in Kaposi sarcoma-associated herpesvirus-infected human B cells.	BRAF
15191558	10.1111/j.0022-202X.2004.22722.x	2004	BRAF point mutations in primary melanoma show different prevalences by subtype.	BRAF
14612909	10.1038/sj.bjc.6601371	2003	BRAF mutations in non-Hodgkin's lymphoma.	BRAF
