pmid	doi	title	Hugo_Symbol
15833862	10.1158/0008-5472.CAN-04-3402	Defective p38 mitogen-activated protein kinase signaling impairs chemotaxic but not proliferative responses to stromal-derived factor-1alpha in acute lymphoblastic leukemia.	CXCR4
33170753	10.1080/17474086.2020.1839885	Chemokine receptor CXCR4: An important player affecting the molecular-targeted drugs commonly used in hematological malignancies.	CXCR4
32265150	10.1016/j.clml.2020.02.016	Increased Muscle CXCR4 Expression in the Setting of Rare Muscle-invasive Multiple Myeloma.	CXCR4
31471373	10.3324/haematol.2019.216218	CXCR4 upregulation is an indicator of sensitivity to B-cell receptor/PI3K blockade and a potential resistance mechanism in B-cell receptor-dependent diffuse large B-cell lymphomas.	CXCR4
31096215	10.1159/000497430	C-X-C Chemokine Receptor 4 in Diffuse Large B Cell Lymphoma: Achievements and Challenges.	CXCR4
30408147	10.1111/bjh.15670	CXCR4 mutations in lymphoplasmacytic lymphoma lead to altered CXCR4 expression.	CXCR4
30190015	10.1016/j.hoc.2018.05.007	Working Toward a Genomic Prognostic Classification of Waldenström Macroglobulinemia: C-X-C Chemokine Receptor Type 4 Mutation and Beyond.	CXCR4
29954928	10.3324/haematol.2017.180505	Pharmacological modulation of CXCR4 cooperates with BET bromodomain inhibition in diffuse large B-cell lymphoma.	CXCR4
29642081	10.1097/RLI.0000000000000469	[68Ga]Ga-Pentixafor PET/MRI for CXCR4 Imaging of Chronic Lymphocytic Leukemia: Preliminary Results.	CXCR4
29363736	10.1111/bjh.15096	Potential influence of concomitant chemotherapy on CXCR4 expression in receptor directed endoradiotherapy.	CXCR4
28282510	10.1016/j.hemonc.2017.01.002	CXCR4 (CD184) expression on stem cell harvest and CD34<sup>+</sup> cells post-transplant.	CXCR4
27268124	10.1016/j.clml.2016.04.014	Clinical Validation of a CXCR4 Mutation Screening Assay for Waldenstrom Macroglobulinemia.	CXCR4
26659815	10.1111/bjh.13897	Clonal architecture of CXCR4 WHIM-like mutations in Waldenström Macroglobulinaemia.	CXCR4
26350264	10.1158/1078-0432.CCR-15-0987	ROS-Induced CXCR4 Signaling Regulates Mantle Cell Lymphoma (MCL) Cell Survival and Drug Resistance in the Bone Marrow Microenvironment via Autophagy.	CXCR4
25704881	10.18632/oncotarget.3343	Dysregulated CXCR4 expression promotes lymphoma cell survival and independently predicts disease progression in germinal center B-cell-like diffuse large B-cell lymphoma.	CXCR4
25378977	10.3904/kjim.2014.29.6.785	Clinical significance of nuclear factor κB and chemokine receptor CXCR4 expression in patients with diffuse large B-cell lymphoma who received rituximab-based therapy.	CXCR4
25231113	10.1002/path.4446	CXCR4 expression enhances diffuse large B cell lymphoma dissemination and decreases patient survival.	CXCR4
24859274	10.1371/journal.pone.0098194	Decreased expression of CXCR4 chemokine receptor in bone marrow after chemotherapy in patients with non-Hodgkin lymphomas is a good prognostic factor.	CXCR4
23754844	10.1158/1541-7786.MCR-13-0114	Dynamic chemotherapy-induced upregulation of CXCR4 expression: a mechanism of therapeutic resistance in pediatric AML.	CXCR4
22936065	10.1038/modpathol.2012.134	Chemokine receptors in gastric MALT lymphoma: loss of CXCR4 and upregulation of CXCR7 is associated with progression to diffuse large B-cell lymphoma.	CXCR4
19391039	10.1080/10428190902893801	Dexamethasone and hypoxia upregulate CXCR4 expression in myeloma cells.	CXCR4
17875700	10.1158/0008-5472.CAN-06-4722	Differential regulation of hypoxia-induced CXCR4 triggering during B-cell development and lymphomagenesis.	CXCR4
17488655	10.3324/haematol.10621	Interaction of interleukin-7 and interleukin-3 with the CXCL12-induced proliferation of B-cell progenitor acute lymphoblastic leukemia.	CXCR4
17198877	10.1016/j.exphem.2006.09.006	Gene-expression profiling during curcumin-induced apoptosis reveals downregulation of CXCR4.	CXCR4
34255748	10.1172/JCI143119	Nuclear PFKP promotes CXCR4-dependent infiltration by T cell acute lymphoblastic leukemia.	CXCR4
32581241	10.1038/s41467-020-16927-w	Synergism between IL7R and CXCR4 drives BCR-ABL induced transformation in Philadelphia chromosome-positive acute lymphoblastic leukemia.	CXCR4
31221512	10.1016/j.clml.2019.03.009	Characteristics of Waldenström Macroglobulinemia in Korean Patients According to Mutational Status of MYD88 and CXCR4: Analysis Using Ultra-Deep Sequencing.	CXCR4
29472546	10.1038/s41408-018-0056-9	CXCR4 can induce PI3Kδ inhibitor resistance in ABC DLBCL.	CXCR4
28952842	10.1080/10428194.2017.1379077	Clinical significance of chemokine receptor CXCR4 and mammalian target of rapamycin (mTOR) expression in patients with diffuse large B-cell lymphoma.	CXCR4
28877839	10.3881/j.issn.1000-503X.2017.04.019	Significances of MYD88<sup>L265P</sup> and CXCR4<sup>WHIM</sup> Mutations in Waldenstrom Macroglobulinemia.	CXCR4
28619846	10.3324/haematol.2016.159517	Acute lymphoblastic leukemia cells create a leukemic niche without affecting the CXCR4/CXCL12 axis.	CXCR4
28280994	10.1007/s00277-017-2968-z	Detection of MYD88 L265P and WHIM-like CXCR4 mutation in patients with IgM monoclonal gammopathy related disease.	CXCR4
27544389	10.1007/s00432-016-2220-6	Differential somatostatin and CXCR4 chemokine receptor expression in MALT-type lymphoma of gastric and extragastric origin.	CXCR4
26931577	10.1189/jlb.5MA0915-394R	Role of CXCR4-mediated bone marrow colonization in CNS infiltration by T cell acute lymphoblastic leukemia.	CXCR4
25819228	10.1111/bjh.13361	MYD88 L265P and CXCR4 mutations in lymphoplasmacytic lymphoma identify cases with high disease activity.	CXCR4
24711662	10.1182/blood-2014-03-564583	C1013G/CXCR4 acts as a driver mutation of tumor progression and modulator of drug resistance in lymphoplasmacytic lymphoma.	CXCR4
24497931	10.1371/journal.pone.0085926	CXCR7 is highly expressed in acute lymphoblastic leukemia and potentiates CXCR4 response to CXCL12.	CXCR4
21740294	10.3109/10428194.2011.601698	Enhancement of the anti-tumor activity of therapeutic monoclonal antibodies by CXCR4 antagonists.	CXCR4
21518481		[Level of SDF-1/CXCR4 in children with acute leukemia and its significance].	CXCR4
20568229	10.1002/jcp.22284	Attenuation of CXCR4 responses by CCL18 in acute lymphocytic leukemia B cells.	CXCR4
15454484	10.1182/blood-2004-03-0799	Chemokine receptor expression in EBV-associated lymphoproliferation in hu/SCID mice: implications for CXCL12/CXCR4 axis in lymphoma generation.	CXCR4
33735664	10.1016/j.neo.2021.02.002	Molecular and genetic biomarkers implemented from next-generation sequencing provide treatment insights in clinical practice for Waldenström macroglobulinemia.	CXCR4
31346528	10.1155/2019/5601396	Notch/CXCR4 Partnership in Acute Lymphoblastic Leukemia Progression.	CXCR4
29153094	10.1016/j.cancergen.2017.09.002	Differences between chronic lymphocytic leukaemia and small lymphocytic lymphoma cells by proteomic profiling and SNP microarray analysis.	CXCR4
28533307	10.1182/blood-2017-04-776740	SOX11 promotes tumor protective microenvironment interactions through CXCR4 and FAK regulation in mantle cell lymphoma.	CXCR4
25681335	10.4049/jimmunol.1402610	Bortezomib inhibits expression of TGF-β1, IL-10, and CXCR4, resulting in decreased survival and migration of cutaneous T cell lymphoma cells.	CXCR4
24366360	10.1182/blood-2013-09-525808	The genomic landscape of Waldenstrom macroglobulinemia is characterized by highly recurring MYD88 and WHIM-like CXCR4 mutations, and small somatic deletions associated with B-cell lymphomagenesis.	CXCR4
24239175	10.1016/j.leukres.2013.10.016	High CXCR4 and low VLA-4 expression predicts poor survival in adults with acute lymphoblastic leukemia.	CXCR4
24035716	10.1016/j.clml.2013.05.013	CXC chemokine receptor 4 expression, CXC chemokine receptor 4 activation, and wild-type nucleophosmin are independently associated with unfavorable prognosis in patients with acute myeloid leukemia.	CXCR4
21474836	10.1177/1087057111403480	Imaging-based assay for identification and characterization of inhibitors of CXCR4-tropic HIV-1 envelope-dependent cell-cell fusion.	CXCR4
21048156	10.1182/blood-2010-01-262691	Chemotherapy resistance in acute lymphoblastic leukemia requires hERG1 channels and is overcome by hERG1 blockers.	CXCR4
20141446	10.3109/10428190903560180	Am80 inhibits stromal cell-derived factor-1-induced chemotaxis in T-cell acute lymphoblastic leukemia cells.	CXCR4
19228923	10.1182/blood-2008-10-185827	Mantle cell lymphoma cells express high levels of CXCR4, CXCR5, and VLA-4 (CD49d): importance for interactions with the stromal microenvironment and specific targeting.	CXCR4
16679918	10.1097/01.mph.0000212908.14642.a5	Chemokine IL-8 and chemokine receptor CXCR3 and CXCR4 gene expression in childhood acute lymphoblastic leukemia at first relapse.	CXCR4
26058076	10.1016/j.ccell.2015.05.003	CXCR4 Is Required for Leukemia-Initiating Cell Activity in T Cell Acute Lymphoblastic Leukemia.	CXCR4
28694325	10.1182/blood-2017-03-770982	TCR-CXCR4 signaling stabilizes cytokine mRNA transcripts via a PREX1-Rac1 pathway: implications for CTCL.	CXCR4
19064997	10.1074/jbc.M804935200	Secreted trefoil factor 2 activates the CXCR4 receptor in epithelial and lymphocytic cancer cell lines.	CXCR4
11157475	10.1182/blood.v97.3.608	SHP2 and cbl participate in alpha-chemokine receptor CXCR4-mediated signaling pathways.	CXCR4
18636124	10.1371/journal.pone.0002816	Polymorphisms in the estrogen receptor 1 and vitamin C and matrix metalloproteinase gene families are associated with susceptibility to lymphoma.	CXCR4
