pmid	doi	year	title	Hugo_Symbol
35583604	10.1158/1078-0432.CCR-21-3347	2022	Interactome of Aiolos/Ikaros Reveals Combination Rationale of Cereblon Modulators with HDAC Inhibitors in DLBCL.	HNRNPU
30209976	10.1080/15384101.2018.1522912	2018	PTPN14 regulates Roquin2 stability by tyrosine dephosphorylation.	HNRNPU
26446488	10.1038/ncomms9325	2015	LRF maintains genome integrity by regulating the non-homologous end joining pathway of DNA repair.	HNRNPU
27980386	10.4137/CIN.S30563	2015	Quantitative Proteomic Approach for MicroRNA Target Prediction Based on <sup>18</sup>O/<sup>16</sup>O Labeling.	HNRNPU
7753047	10.1016/0161-5890(95)00005-y	1995	Binding sites of the Epstein-Barr virus and C3d receptor (CR2, CD21) for its three intracellular ligands, the p53 anti-oncoprotein, the p68 calcium binding protein and the nuclear p120 ribonucleoprotein.	HNRNPU
