pmid	doi	year	title	Hugo_Symbol
33767152	10.1038/s41419-021-03594-y	2021	A novel lncRNA TCLlnc1 promotes peripheral T cell lymphoma progression through acting as a modular scaffold of HNRNPD and YBX1 complexes.	HNRNPD
30681073	10.12659/MSM.912082	2019	Berberine Promotes Apoptosis of Colorectal Cancer via Regulation of the Long Non-Coding RNA (lncRNA) Cancer Susceptibility Candidate 2 (CASC2)/AU-Binding Factor 1 (AUF1)/B-Cell CLL/Lymphoma 2 (Bcl-2) Axis.	HNRNPD
30209976	10.1080/15384101.2018.1522912	2018	PTPN14 regulates Roquin2 stability by tyrosine dephosphorylation.	HNRNPD
30210700		2018	Survival associated alternative splicing events in diffuse large B-cell lymphoma.	HNRNPD
27578251	10.1038/srep32189	2016	The long noncoding RNA ASNR regulates degradation of Bcl-2 mRNA through its interaction with AUF1.	HNRNPD
22159912	10.1007/s00125-011-2399-7	2012	Involvement of the RNA-binding protein ARE/poly(U)-binding factor 1 (AUF1) in the cytotoxic effects of proinflammatory cytokines on pancreatic beta cells.	HNRNPD
19520857	10.1074/jbc.M109.023721	2009	B cell lymphoma (Bcl)-2 protein is the major determinant in bcl-2 adenine-uridine-rich element turnover overcoming HuR activity.	HNRNPD
16835382	10.1182/blood-2006-04-014902	2006	A liaison dangereuse between AUF1/hnRNPD and the oncogenic tyrosine kinase NPM-ALK.	HNRNPD
