pmid	doi	year	title	Hugo_Symbol
19571464	10.1254/jphs.08339fp	2009	Role of myeloid cell leukemia-1 in cell growth of squamous cell carcinoma.	MCL1
17761520	10.1182/blood-2006-10-053884	2008	FTY720 demonstrates promising preclinical activity for chronic lymphocytic leukemia and lymphoblastic leukemia/lymphoma.	MCL1
18032706	10.1182/blood-2007-09-110601	2008	Lentiviral (HIV)-based RNA interference screen in human B-cell receptor regulatory networks reveals MCL1-induced oncogenic pathways.	MCL1
18055695	10.1101/gad.1604407	2008	Dissecting eIF4E action in tumorigenesis.	MCL1
18275607	10.1186/1476-4598-7-20	2008	Preclinical studies of Apogossypolone: a new nonpeptidic pan small-molecule inhibitor of Bcl-2, Bcl-XL and Mcl-1 proteins in Follicular Small Cleaved Cell Lymphoma model.	MCL1
18349030	10.1093/annonc/mdn056	2008	Arsenic trioxide down-regulates antiapoptotic genes and induces cell death in mycosis fungoides tumors in a mouse model.	MCL1
18589438	10.1016/j.jmb.2008.05.071	2008	Structure of the BH3 domains from the p53-inducible BH3-only proteins Noxa and Puma in complex with Mcl-1.	MCL1
18664580	10.1073/pnas.0804821105	2008	mTORC1 promotes survival through translational control of Mcl-1.	MCL1
18689543	10.1182/blood-2007-11-124487	2008	Targeting Bcl-2 family proteins modulates the sensitivity of B-cell lymphoma to rituximab-induced apoptosis.	MCL1
16949642	10.1016/j.humpath.2006.06.017	2007	Expression of bcl2 family proteins and active caspase 3 in classical Hodgkin's lymphomas.	MCL1
17097560	10.1016/j.ccr.2006.10.006	2007	Mechanisms of apoptosis sensitivity and resistance to the BH3 mimetic ABT-737 in acute myeloid leukemia.	MCL1
17097561	10.1016/j.ccr.2006.08.027	2007	The BH3 mimetic ABT-737 targets selective Bcl-2 proteins and efficiently induces apoptosis via Bak/Bax if Mcl-1 is neutralized.	MCL1
17116485	10.1016/j.cancergencyto.2006.04.019	2007	Complex secondary chromosome abnormalities in advanced stage anaplastic large cell lymphoma of children and adolescents: a report from CCG-E08.	MCL1
17200714	10.1172/JCI28281	2007	Chronic lymphocytic leukemia requires BCL2 to sequester prodeath BIM, explaining sensitivity to BCL2 antagonist ABT-737.	MCL1
17227835	10.1182/blood-2006-07-034173	2007	The BH3-mimetic GX15-070 synergizes with bortezomib in mantle cell lymphoma by enhancing Noxa-mediated activation of Bak.	MCL1
18025305	10.1083/jcb.200703040	2007	Mcl-1 determines the Bax dependency of Nbk/Bik-induced apoptosis.	MCL1
16189266	10.1182/blood-2005-07-2930	2006	The expression of 70 apoptosis genes in relation to lineage, genetic subtype, cellular drug resistance, and outcome in childhood acute lymphoblastic leukemia.	MCL1
16382050	10.1196/annals.1339.047	2006	Functional validation of genes implicated in lymphomagenesis: an in vivo selection assay using a Myc-induced B-cell tumor.	MCL1
16763612	10.1038/modpathol.3800632	2006	Pathway-specific apoptotic gene expression profiling in chronic lymphocytic leukemia and follicular lymphoma.	MCL1
17010674	10.1016/j.ccr.2006.09.006	2006	Gene expression-based chemical genomics identifies rapamycin as a modulator of MCL1 and glucocorticoid resistance.	MCL1
15370246	10.1080/10428190410001723317	2005	Role of myeloid cell factor-1 (Mcl-1) in chronic lymphocytic leukemia.	MCL1
15550399	10.1074/jbc.M411434200	2005	Solution structure of prosurvival Mcl-1 and characterization of its binding by proapoptotic BH3-only ligands.	MCL1
15613543	10.1182/blood-2004-10-3984	2005	Evidence for a protective role of Mcl-1 in proteasome inhibitor-induced apoptosis.	MCL1
15718423	10.1182/blood-2004-05-1699	2005	Cell death of bioenergetically compromised and transcriptionally challenged CLL lymphocytes by chlorinated ATP.	MCL1
15897243	10.1158/1535-7163.MCT-04-0330	2005	Fibroblast growth factor receptor 3 inhibition by short hairpin RNAs leads to apoptosis in multiple myeloma.	MCL1
15905648	10.1159/000084213	2005	Positional and functional characterisation of apoptosis related genes belonging to the BCL2 family in sheep.	MCL1
16007205	10.1038/sj.onc.1208751	2005	Comparative genomic hybridization on mouse cDNA microarrays and its application to a murine lymphoma model.	MCL1
15122313	10.1038/sj.onc.1207648	2004	Mcl-1 is required for Akata6 B-lymphoma cell survival and is converted to a cell death molecule by efficient caspase-mediated cleavage.	MCL1
15126604	10.1093/jnci/djh122	2004	Prognostic significance of a short sequence insertion in the MCL-1 promoter in chronic lymphocytic leukemia.	MCL1
15240948	10.1292/jvms.66.709	2004	Molecular cloning of canine Mcl-1 gene and its expression in tumor cell lines.	MCL1
12580957	10.1046/j.1365-2141.2003.04121.x	2003	Abnormal expression of apoptosis-related genes in haematological malignancies: overexpression of MYC is poor prognostic sign in mantle cell lymphoma.	MCL1
11830549		2002	An MCL1-overexpressing Burkitt lymphoma subline exhibits enhanced survival on exposure to serum deprivation, topoisomerase inhibitors, or staurosporine but remains sensitive to 1-beta-D-arabinofuranosylcytosine.	MCL1
11841410	10.1046/j.1365-2141.2002.03253.x	2002	High expression of MCL1 gene related to vascular endothelial growth factor is associated with poor outcome in non-Hodgkin's lymphoma.	MCL1
12057933	10.1016/S0002-9440(10)61178-9	2002	Overexpression of Mcl-1 in anaplastic large cell lymphoma cell lines and tumors.	MCL1
10978339	10.1074/jbc.M006626200	2001	Regulation of apoptosis and cell cycle progression by MCL1. Differential role of proliferating cell nuclear antigen.	MCL1
11389033	10.1182/blood.v97.12.3902	2001	MCL1 transgenic mice exhibit a high incidence of B-cell lymphoma manifested as a spectrum of histologic subtypes.	MCL1
10637245	10.1200/JCO.2000.18.2.317	2000	European phase II study of rituximab (chimeric anti-CD20 monoclonal antibody) for patients with newly diagnosed mantle-cell lymphoma and previously treated mantle-cell lymphoma, immunocytoma, and small B-cell lymphocytic lymphoma.	MCL1
10697273	10.1038/modpathol.3880030	2000	Overexpression of BCL-2, BCL-X, and BAX in primary central nervous system lymphomas that occur in immunosuppressed patients.	MCL1
10707792		2000	Treatment of mantle-cell lymphoma with Rituximab (chimeric monoclonal anti-CD20 antibody): analysis of factors associated with response.	MCL1
10777489	10.1074/jbc.M000915200	2000	Myeloid cell leukemia 1 is phosphorylated through two distinct pathways, one associated with extracellular signal-regulated kinase activation and the other with G2/M accumulation or protein phosphatase 1/2A inhibition.	MCL1
10090728	10.1101/gad.13.6.718	1999	Role of Nr13 in regulation of programmed cell death in the bursa of Fabricius.	MCL1
8587122	10.1007/BF00173157	1996	Molecular evolution and secondary structural conservation in the B-cell lymphoma leukemia 2 (bcl-2) family of proto-oncogene products.	MCL1
7835896	10.1006/geno.1994.1523	1995	Human and mouse chromosomal mapping of the myeloid cell leukemia-1 gene: MCL1 maps to human chromosome 1q21, a region that is frequently altered in preneoplastic and neoplastic disease.	MCL1
