pmid	doi	year	title	Hugo_Symbol
23873701	10.1002/gcc.22088	2013	BMI1, the polycomb-group gene, is recurrently targeted by genomic rearrangements in progressive B-cell leukemia/lymphoma.	NOTCH1
23898065		2013	Effects of the HIF1 inhibitor, echinomycin, on growth and NOTCH signalling in leukaemia cells.	NOTCH1
23908464	10.1182/blood-2013-05-500850	2013	Genetic loss of SH2B3 in acute lymphoblastic leukemia.	NOTCH1
23982259	10.1007/s11033-013-2654-8	2013	Investigation of deregulated genes of Notch signaling pathway in human T cell acute lymphoblastic leukemia cell lines and clinical samples.	NOTCH1
24014297	10.1007/978-1-4614-8051-8_8	2013	Richter syndrome.	NOTCH1
24041576	10.1182/blood-2013-08-460311	2013	Genome sequencing of lymphoid malignancies.	NOTCH1
24046360	10.1242/dmm.012575	2013	A mouse model for inducible overexpression of Prdm14 results in rapid-onset and highly penetrant T-cell acute lymphoblastic leukemia (T-ALL).	NOTCH1
24090996	10.1016/j.leukres.2013.09.007	2013	Distinct sensitivity of CD8+ CD4- and CD8+ CD4+ leukemic cell subpopulations to cyclophosphamide and rapamycin in Notch1-induced T-ALL mouse model.	NOTCH1
24127483	10.1084/jem.20131448	2013	Genetic lesions associated with chronic lymphocytic leukemia transformation to Richter syndrome.	NOTCH1
24145436	10.1073/pnas.1314608110	2013	Landscape of somatic mutations and clonal evolution in mantle cell lymphoma.	NOTCH1
24166518	10.1200/JCO.2012.48.5292	2013	Toward a NOTCH1/FBXW7/RAS/PTEN-based oncogenetic risk classification of adult T-cell acute lymphoblastic leukemia: a Group for Research in Adult Acute Lymphoblastic Leukemia study.	NOTCH1
24174626	10.1182/blood-2012-08-451278	2013	In vivo leukemogenic potential of an interleukin 7 receptor α chain mutant in hematopoietic stem and progenitor cells.	NOTCH1
24370020	10.7534/j.issn.1009-2137.2013.06.008	2013	[Characteristics of NOTCH1 mutation in adult T-cell acute lymphoblastic leukemia].	NOTCH1
24386421	10.1371/journal.pone.0084841	2013	Characterization of two distinct lymphoproliferative diseases caused by ectopic expression of the Notch ligand DLL4 on T cells.	NOTCH1
21984373	10.1002/path.3015	2012	Notch1 regulates chemotaxis and proliferation by controlling the CC-chemokine receptors 5 and 9 in T cell acute lymphoblastic leukaemia.	NOTCH1
22116551	10.1038/leu.2011.328	2012	Aberrant expression of RasGRP1 cooperates with gain-of-function NOTCH1 mutations in T-cell leukemogenesis.	NOTCH1
22171922	10.1111/j.1365-2141.2011.08980.x	2012	Absence of NOTCH1 gene mutations in MALT lymphomas.	NOTCH1
22210878	10.1182/blood-2011-11-391474	2012	Whole transcriptome sequencing reveals recurrent NOTCH1 mutations in mantle cell lymphoma.	NOTCH1
22311010	10.1007/s11033-011-1424-8	2012	The indicative effect of Notch1 expression for the prognosis of T-cell acute lymphocytic leukemia: a systematic review.	NOTCH1
22348144	10.1371/journal.pone.0032047	2012	The translation factor eIF6 is a Notch-dependent regulator of cell migration and invasion.	NOTCH1
22357466		2012	[Gene expression of Notch1 and Jagged1 in children with acute leukemia].	NOTCH1
22393458	10.1371/journal.pone.0032944	2012	Enhanced Notch activation is advantageous but not essential for T cell lymphomagenesis in Id1 transgenic mice.	NOTCH1
22424712	10.1016/j.leukres.2012.02.013	2012	Notch-mediated repression of miR-223 contributes to IGF1R regulation in T-ALL.	NOTCH1
22491738	10.3324/haematol.2011.059030	2012	The significance of PTEN and AKT aberrations in pediatric T-cell acute lymphoblastic leukemia.	NOTCH1
22510873	10.1182/blood-2011-10-388504	2012	An activating intragenic deletion in NOTCH1 in human T-ALL.	NOTCH1
22571487	10.1111/j.1365-2141.2012.09155.x	2012	Different impact of NOTCH1 and SF3B1 mutations on the risk of chronic lymphocytic leukemia transformation to Richter syndrome.	NOTCH1
22673746	10.1007/82_2012_232	2012	Recent advances on NOTCH signaling in T-ALL.	NOTCH1
22695916	10.1007/82_2012_231	2012	Notch1 and IL-7 receptor signalling in early T-cell development and leukaemia.	NOTCH1
22718117	10.1038/jid.2012.203	2012	NOTCH1 signaling as a therapeutic target in Sézary syndrome.	NOTCH1
22768113	10.1371/journal.pone.0039725	2012	NOTCH1 signaling promotes human T-cell acute lymphoblastic leukemia initiating cell regeneration in supportive niches.	NOTCH1
23022380	10.1016/j.molcel.2012.08.022	2012	NOTCH1 nuclear interactome reveals key regulators of its transcriptional activity and oncogenic function.	NOTCH1
23086478	10.1038/nm.2960	2012	NOTCH1 promotes T cell leukemia-initiating activity by RUNX-mediated regulation of PKC-θ and reactive oxygen species.	NOTCH1
20965628	10.1016/j.blre.2010.09.004	2011	Molecular pathogenesis and targeted therapies for NOTCH1-induced T-cell acute lymphoblastic leukemia.	NOTCH1
21052088	10.1038/leu.2010.255	2011	Natural killer cell lymphoma shares strikingly similar molecular features with a group of non-hepatosplenic γδ T-cell lymphoma and is highly sensitive to a novel aurora kinase A inhibitor in vitro.	NOTCH1
21326611	10.1371/journal.pone.0016761	2011	Transient responses to NOTCH and TLX1/HOX11 inhibition in T-cell acute lymphoblastic leukemia/lymphoma.	NOTCH1
21464222	10.1084/jem.20102384	2011	Repression of tumor suppressor miR-451 is essential for NOTCH1-induced oncogenesis in T-ALL.	NOTCH1
21556011	10.1038/leu.2011.96	2011	Occurrence of identical NOTCH1 mutation in non-twinned sisters with T-cell acute lymphoblastic leukemia.	NOTCH1
21625236	10.1038/leu.2011.130	2011	Redundancy and specificity of the metalloprotease system mediating oncogenic NOTCH1 activation in T-ALL.	NOTCH1
21631271	10.5858/2009-0691-OA.1	2011	Uniform expression of Notch1, suppressor of B-cell-specific gene expression, in plasmablastic lymphoma.	NOTCH1
21775206	10.1016/j.it.2011.06.005	2011	Notch in T-ALL: new players in a complex disease.	NOTCH1
21807868	10.1084/jem.20110121	2011	High-level IGF1R expression is required for leukemia-initiating cell activity in T-ALL and is supported by Notch signaling.	NOTCH1
21835957	10.1182/blood-2011-02-334219	2011	Pediatric-inspired intensified therapy of adult T-ALL reveals the favorable outcome of NOTCH1/FBXW7 mutations, but not of low ERG/BAALC expression: a GRAALL study.	NOTCH1
21880637	10.3324/haematol.2011.043083	2011	Mutations of PHF6 are associated with mutations of NOTCH1, JAK1 and rearrangement of SET-NUP214 in T-cell acute lymphoblastic leukemia.	NOTCH1
21979940	10.1182/blood-2011-08-376061	2011	Notch signaling in acute lymphoblastic leukemia: any role for stromal microenvironment?	NOTCH1
22006338	10.1073/pnas.1114669108	2011	Loss-of-function mutations in Notch receptors in cutaneous and lung squamous cell carcinoma.	NOTCH1
22022427	10.1371/journal.pone.0025645	2011	Notch ankyrin repeat domain variation influences leukemogenesis and Myc transactivation.	NOTCH1
19631984	10.1016/j.leukres.2009.06.026	2010	T-cell lymphoblastic leukemia in early childhood presents NOTCH1 mutations and MLL rearrangements.	NOTCH1
19847202	10.1038/leu.2009.221	2010	Wilms tumor 1 (WT1) gene mutations in pediatric T-cell malignancies.	NOTCH1
20348880	10.1038/modpathol.2010.67	2010	Notch1 in primary effusion lymphoma: a clinicopathological study.	NOTCH1
20538790	10.1182/blood-2009-12-260216	2010	Notch1 as a potential therapeutic target in cutaneous T-cell lymphoma.	NOTCH1
20683149	10.3233/DMA-2010-0715	2010	Prognostic significance of NOTCH1 and FBXW7 mutations in pediatric T-ALL.	NOTCH1
20823234	10.1073/pnas.1010722107	2010	Notch signaling contributes to proliferation and tumor formation of human T-cell leukemia virus type 1-associated adult T-cell leukemia.	NOTCH1
20861909	10.1038/leu.2010.204	2010	NOTCH1 and/or FBXW7 mutations predict for initial good prednisone response but not for improved outcome in pediatric T-cell acute lymphoblastic leukemia patients treated on DCOG or COALL protocols.	NOTCH1
20861920	10.1038/leu.2010.205	2010	NOTCH1 and FBXW7 mutations have a favorable impact on early response to treatment, but not on outcome, in children with T-cell acute lymphoblastic leukemia (T-ALL) treated on EORTC trials 58881 and 58951.	NOTCH1
20944675	10.1038/leu.2010.203	2010	The favorable effect of activating NOTCH1 receptor mutations on long-term outcome in T-ALL patients treated on the ALL-BFM 2000 protocol can be separated from FBXW7 loss of function.	NOTCH1
21302811	10.3727/096504010x12864748215007	2010	Mutations in the HD and PEST domain of Notch-1 receptor in T-cell acute lymphoblastic leukemia: report of novel mutations from Indian population.	NOTCH1
18984862	10.1182/blood-2008-02-138172	2009	NOTCH is a key regulator of human T-cell acute leukemia initiating cell activity.	NOTCH1
19057901	10.1007/s00277-008-0646-x	2009	Downregulation of Notch signaling by gamma-secretase inhibition can abrogate chemotherapy-induced apoptosis in T-ALL cell lines.	NOTCH1
19091404	10.1016/j.leukres.2008.10.026	2009	Notch-1 regulates Akt signaling pathway and the expression of cell cycle regulatory proteins cyclin D1, CDK2 and p21 in T-ALL cell lines.	NOTCH1
19109228	10.1182/blood-2008-10-184069	2009	NOTCH1/FBXW7 mutation identifies a large subgroup with favorable outcome in adult T-cell acute lymphoblastic leukemia (T-ALL): a Group for Research on Adult Acute Lymphoblastic Leukemia (GRAALL) study.	NOTCH1
19151773	10.1038/leu.2008.366	2009	A second NOTCH1 chromosome rearrangement: t(9;14)(q34.3;q11.2) in T-cell neoplasia.	NOTCH1
19160126	10.1080/10428190802553257	2009	Down-regulation of Notch-1 increases co-cultured Jurkat cell sensitivity to chemotherapy.	NOTCH1
19239437	10.1111/j.1600-0463.2008.00023.x	2009	Analysis of NOTCH1 extracellular juxtamembrane expansion mutations in acute leukemias and multiple myelomas.	NOTCH1
19245433	10.1111/j.1365-2141.2009.07607.x	2009	FBXW7 and NOTCH1 mutations in childhood T cell acute lymphoblastic leukaemia and T cell non-Hodgkin lymphoma.	NOTCH1
19339697	10.1182/blood-2008-11-190090	2009	Notch1, Notch2, and Epstein-Barr virus-encoded nuclear antigen 2 signaling differentially affects proliferation and survival of Epstein-Barr virus-infected B cells.	NOTCH1
19340001	10.1038/leu.2009.64	2009	The impact of NOTCH1, FBW7 and PTEN mutations on prognosis and downstream signaling in pediatric T-cell acute lymphoblastic leukemia: a report from the Children's Oncology Group.	NOTCH1
19635999	10.1200/JCO.2009.22.0996	2009	Prognostic implications of NOTCH1 and FBXW7 mutations in adults with T-cell acute lymphoblastic leukemia treated on the MRC UKALLXII/ECOG E2993 protocol.	NOTCH1
19704010	10.1128/MCB.00406-09	2009	Selective use of ADAM10 and ADAM17 in activation of Notch1 signaling.	NOTCH1
19778842	10.3816/CLM.2009.s.013	2009	Therapeutic targeting of NOTCH1 signaling in T-cell acute lymphoblastic leukemia.	NOTCH1
19794083	10.3324/haematol.2008.005272	2009	Prognostic implications of NOTCH1 and FBXW7 mutations in adult acute T-lymphoblastic leukemia.	NOTCH1
19907488	10.1038/nature08543	2009	Direct inhibition of the NOTCH transcription factor complex.	NOTCH1
20008221	10.1182/asheducation-2009.1.353	2009	The role of NOTCH1 signaling in T-ALL.	NOTCH1
17874453	10.1002/ajh.21044	2008	Aggressive Langerhans cell histiocytosis following T-ALL: clonally related neoplasms with persistent expression of constitutively active NOTCH1.	NOTCH1
17901244	10.1182/blood-2007-02-074690	2008	NOTCH1 mutation can be an early, prenatal genetic event in T-ALL.	NOTCH1
17980397	10.1016/j.virol.2007.10.009	2008	An auto-regulatory loop for EBV LMP2A involves activation of Notch.	NOTCH1
18411416	10.1182/blood-2007-12-130096	2008	NOTCH1 extracellular juxtamembrane expansion mutations in T-ALL.	NOTCH1
18449208	10.1038/leu.2008.101	2008	Aberrant expression of Notch1 interferes with the B-lymphoid phenotype of neoplastic B cells in classical Hodgkin lymphoma.	NOTCH1
18663146	10.1182/blood-2008-03-147587	2008	K-RasG12D-induced T-cell lymphoblastic lymphoma/leukemias harbor Notch1 mutations and are sensitive to gamma-secretase inhibitors.	NOTCH1
17252014	10.1038/sj.leu.2404546	2007	NOTCH1-induced T-cell leukemia in transgenic zebrafish.	NOTCH1
17560996	10.1016/j.yexcr.2007.04.027	2007	Notch signaling induces SKP2 expression and promotes reduction of p27Kip1 in T-cell acute lymphoblastic leukemia cell lines.	NOTCH1
17646408	10.1084/jem.20070872	2007	The SCFFBW7 ubiquitin ligase complex as a tumor suppressor in T cell leukemia.	NOTCH1
17671232	10.1182/blood-2007-02-073486	2007	Distinct gene expression profiles of acute myeloid/T-lymphoid leukemia with silenced CEBPA and mutations in NOTCH1.	NOTCH1
18056171	10.1158/1078-0432.CCR-07-1474	2007	Notch-1 mutations are secondary events in some patients with T-cell acute lymphoblastic leukemia.	NOTCH1
18184405	10.1111/j.1600-0463.2007.00751.x	2007	Mutational analysis of NOTCH1, 2, 3 and 4 genes in common solid cancers and acute leukemias.	NOTCH1
16449526	10.1182/blood-2005-09-3551	2006	Notch1 promotes survival of E2A-deficient T cell lymphomas through pre-T cell receptor-dependent and -independent mechanisms.	NOTCH1
16651424	10.1158/0008-5472.CAN-05-3830	2006	Survival signaling by Notch1: mammalian target of rapamycin (mTOR)-dependent inhibition of p53.	NOTCH1
16688224	10.1038/sj.leu.2404258	2006	CUTLL1, a novel human T-cell lymphoma cell line with t(7;9) rearrangement, aberrant NOTCH1 activation and high sensitivity to gamma-secretase inhibitors.	NOTCH1
16707600	10.1158/1078-0432.CCR-05-2832	2006	NOTCH1 mutations in T-cell acute lymphoblastic leukemia: prognostic significance and implication in multifactorial leukemogenesis.	NOTCH1
16738328	10.1128/MCB.01655-05	2006	Leukemia-associated mutations within the NOTCH1 heterodimerization domain fall into at least two distinct mechanistic classes.	NOTCH1
16880534	10.1128/MCB.02478-05	2006	Identification of a conserved negative regulatory sequence that influences the leukemogenic activity of NOTCH1.	NOTCH1
16887975	10.4049/jimmunol.177.4.2153	2006	Structurally distinct ligand-binding or ligand-independent Notch1 mutants are leukemogenic but affect thymocyte development, apoptosis, and metastasis differently.	NOTCH1
17107915	10.1080/10428190600773339	2006	NOTCH1 mutations are rare in acute myeloid leukemia.	NOTCH1
15756589	10.1007/s00428-005-1214-6	2005	Amplification of NOTCH1 and ABL1 gene loci is a frequent aberration in enteropathy-type T-cell lymphoma.	NOTCH1
16079893	10.1038/sj.leu.2403896	2005	Mutations of the Notch1 gene in T-cell acute lymphoblastic leukemia: analysis in adults and children.	NOTCH1
16298817	10.1532/IJH97.05096	2005	Deregulated NOTCH signaling in acute T-cell lymphoblastic leukemia/lymphoma: new insights, questions, and opportunities.	NOTCH1
15472075	10.1126/science.1102160	2004	Activating mutations of NOTCH1 in human T cell acute lymphoblastic leukemia.	NOTCH1
12509463	10.1128/MCB.23.2.655-664.2003	2003	Growth suppression of pre-T acute lymphoblastic leukemia cells by inhibition of notch signaling.	NOTCH1
12532332	10.1002/jcb.10383	2003	Differential regulation of Notch signal transduction in leukaemia and lymphoma cells in culture.	NOTCH1
11964309	10.1182/blood.v99.9.3398	2002	Activated Notch1 signaling promotes tumor cell proliferation and survival in Hodgkin and anaplastic large cell lymphoma.	NOTCH1
11739188	10.1182/blood.v98.13.3793	2001	A novel Notch ligand, Dll4, induces T-cell leukemia/lymphoma when overexpressed in mice by retroviral-mediated gene transfer.	NOTCH1
9111040	10.1074/jbc.272.17.11336	1997	Oncogenic forms of NOTCH1 lacking either the primary binding site for RBP-Jkappa or nuclear localization sequences retain the ability to associate with RBP-Jkappa and activate transcription.	NOTCH1
1831692	10.1016/0092-8674(91)90111-b	1991	TAN-1, the human homolog of the Drosophila notch gene, is broken by chromosomal translocations in T lymphoblastic neoplasms.	NOTCH1
