pmid	doi	year	title	Hugo_Symbol
21233409	10.1189/jlb.0810441	2011	Statins inhibit T-acute lymphoblastic leukemia cell adhesion and migration through Rap1b.	RHOA
21372162	10.1152/ajpgi.00409.2010	2011	Activation of Dbl restores migration in polyamine-depleted intestinal epithelial cells via Rho-GTPases.	RHOA
21868386	10.1074/jbc.M111.255489	2011	Involvement of 14-3-3 proteins in the second epidermal growth factor-induced wave of Rac1 activation in the process of cell migration.	RHOA
19773279	10.1136/oem.2008.044024	2010	Association between genetic variants in VEGF, ERCC3 and occupational benzene haematotoxicity.	RHOA
20127004		2010	Curcumin blocks migration and invasion of mouse-rat hybrid retina ganglion cells (N18) through the inhibition of MMP-2, -9, FAK, Rho A and Rock-1 gene expression.	RHOA
18592271	10.1007/s00432-008-0437-8	2009	Tiam1-deficiency impairs mammary tumor formation in MMTV-c-neu but not in MMTV-c-myc mice.	RHOA
19082465		2009	Progression of breast tumors is accompanied by a decrease in expression of the Rho guanine exchange factor Tiam1.	RHOA
19734146	10.1074/jbc.M109.014506	2009	Speckled-like pattern in the germinal center (SLIP-GC), a nuclear GTPase expressed in activation-induced deaminase-expressing lymphomas and germinal center B cells.	RHOA
18084615	10.1593/neo.07727	2008	Statins stimulate in vitro membrane FasL expression and lymphocyte apoptosis through RhoA/ROCK pathway in murine melanoma cells.	RHOA
18373239	10.1007/s00005-008-0016-3	2008	Role of response gene to complement 32 in diseases.	RHOA
18374178	10.1016/S0076-6879(07)00427-2	2008	Rho GTPases and regulation of hematopoietic stem cell localization.	RHOA
18625202	10.1016/j.bbrc.2008.07.012	2008	HMG-CoA reductase inhibitor simvastatin overcomes bortezomib-induced apoptosis resistance by disrupting a geranylgeranyl pyrophosphate-dependent survival pathway.	RHOA
18653465	10.1091/mbc.e08-06-0558	2008	Paracingulin regulates the activity of Rac1 and RhoA GTPases by recruiting Tiam1 and GEF-H1 to epithelial junctions.	RHOA
17197023	10.1016/j.leukres.2006.11.016	2007	PEG-Filgrastim activity on granulocyte functions.	RHOA
17562871	10.1128/MCB.00778-07	2007	Role of phospholipase Cgamma1 in cell spreading requires association with a beta-Pix/GIT1-containing complex, leading to activation of Cdc42 and Rac1.	RHOA
16472687	10.1016/S0076-6879(06)06043-5	2006	Rational design and applications of a Rac GTPase-specific small molecule inhibitor.	RHOA
15340013	10.1242/jcs.01367	2005	The RacGEF Tiam1 inhibits migration and invasion of metastatic melanoma via a novel adhesive mechanism.	RHOA
15916805	10.1016/j.leukres.2005.04.011	2005	Glycosylated or non-glycosylated G-CSF differently influence human granulocyte functions through RhoA.	RHOA
16024605	10.1158/0008-5472.CAN-05-0175	2005	Rho GDP dissociation inhibitor protects cancer cells against drug-induced apoptosis.	RHOA
14530271	10.1074/jbc.M310069200	2004	Protein profile of tax-associated complexes.	RHOA
14550769	10.1016/s1044-7431(03)00122-2	2004	Roles of STEF/Tiam1, guanine nucleotide exchange factors for Rac1, in regulation of growth cone morphology.	RHOA
15332996	10.1667/rr3220	2004	Nuclear translocation of cleaved LyGDI dissociated from Rho and Rac during Trp53-dependent ionizing radiation-induced apoptosis of thymus cells in vitro.	RHOA
15504914	10.1083/jcb.200403091	2004	Roles of p-ERM and Rho-ROCK signaling in lymphocyte polarity and uropod formation.	RHOA
12393875	10.1074/jbc.M210151200	2003	Rac activation by lysophosphatidic acid LPA1 receptors through the guanine nucleotide exchange factor Tiam1.	RHOA
12629517	10.1038/sj.onc.1206239	2003	Wnt signaling in B-cell neoplasia.	RHOA
11604996	10.3892/ijo.19.5.971	2002	K-ras and rho A mutations in malignant pleural effusion.	RHOA
11839748	10.1074/jbc.M110981200	2002	Activation of clg, a novel dbl family guanine nucleotide exchange factor gene, by proviral insertion at evi24, a common integration site in B cell and myeloid leukemias.	RHOA
12006984	10.1038/nsb796	2002	Structural basis for the selective activation of Rho GTPases by Dbl exchange factors.	RHOA
11254681	10.4049/jimmunol.166.7.4293	2001	Stromal cell-derived factor-1-induced LFA-1 activation during in vivo migration of T cell hybridoma cells requires Gq/11, RhoA, and myosin, as well as Gi and Cdc42.	RHOA
11274357	10.1073/pnas.071411598	2001	Tumor metastasis suppressor nm23H1 regulates Rac1 GTPase by interaction with Tiam1.	RHOA
11551917	10.1074/jbc.M105049200	2001	Rac affects invasion of human renal cell carcinomas by up-regulating tissue inhibitor of metalloproteinases (TIMP)-1 and TIMP-2 expression.	RHOA
10508262	10.1002/(SICI)1521-4141(199909)29:09&lt;2875::AID-IMMU2875&gt;3.0.CO;2-I	1999	The small GTP-binding proteins Rho and Rac induce T cell adhesion to the mucosal addressin MAdCAM-1 in a hierarchical fashion.	RHOA
10556816	10.1002/(SICI)1521-4141(199911)29:11&lt;3609::AID-IMMU3609&gt;3.0.CO;2-S	1999	Rho GTPases control migration and polarization of adhesion molecules and cytoskeletal ERM components in T lymphocytes.	RHOA
9670021	10.1093/emboj/17.14.4066	1998	Invasion of T-lymphoma cells: cooperation between Rho family GTPases and lysophospholipid receptor signaling.	RHOA
9053294	10.1007/978-3-642-61109-4_12	1997	Role of Tiam 1 in Rac-mediated signal transduction pathways.	RHOA
9348295	10.1083/jcb.139.3.797	1997	The guanine nucleotide exchange factor Tiam1 affects neuronal morphology; opposing roles for the small GTPases Rac and Rho.	RHOA
7753201	10.1038/375338a0	1995	A role for Rac in Tiam1-induced membrane ruffling and invasion.	RHOA
8250908	10.1006/bbrc.1993.2424	1994	Characterization of a monoclonal antibody specific for the Ras-related GTP-binding protein Rho A.	RHOA
