pmid	doi	year	title	Hugo_Symbol
26514535	10.7314/apjcp.2015.16.16.7343	2016	Importance of FISH combined with Morphology, Immunophenotype and Cytogenetic Analysis of Childhood/ Adult Acute Lymphoblastic Leukemia in Omani Patients.	RUNX1
26520622	10.1016/j.leukres.2015.10.006	2016	Preserved global histone H4 acetylation linked to ETV6-RUNX1 fusion and PAX5 deletions is associated with favorable outcome in pediatric B-cell progenitor acute lymphoblastic leukemia.	RUNX1
26580398	10.1371/journal.pone.0142863	2016	A Double Negative Loop Comprising ETV6/RUNX1 and MIR181A1 Contributes to Differentiation Block in t(12;21)-Positive Acute Lymphoblastic Leukemia.	RUNX1
26625756	10.7314/apjcp.2015.16.17.7523	2016	Low Frequency of ETV6-RUNX1 (t 12; 21) in Saudi Arabian Pediatric Acute Lymphoblastic Leukemia Patients: Association with Clinical Parameters and Early Remission.	RUNX1
26628061	10.1111/bjh.13861	2016	Identification of novel biomarkers in chronic immune thrombocytopenia (ITP) by microarray-based serum protein profiling.	RUNX1
26670384	10.1128/mBio.01863-15	2016	Common Viral Integration Sites Identified in Avian Leukosis Virus-Induced B-Cell Lymphomas.	RUNX1
26693794	10.3109/10428194.2015.1115041	2016	Genetic predisposition to myelodysplastic syndrome and acute myeloid leukemia in children and young adults.	RUNX1
26697989	10.1016/j.critrevonc.2015.11.004	2016	Myeloproliferative neoplasms: Current molecular biology and genetics.	RUNX1
26711002	10.1002/cam4.579	2016	Determination of ETV6-RUNX1 genomic breakpoint by next-generation sequencing.	RUNX1
26781410		2016	[Detection of copy number variations in pediatric ETV6/RUNX1-positive acute lymphoblastic leukemia with multiplex ligation-dependent probe amplification].	RUNX1
26785729	10.1074/mcp.M115.054593	2016	High-resolution Antibody Array Analysis of Childhood Acute Leukemia Cells.	RUNX1
26852652	10.1016/j.bcmd.2015.11.006	2016	ETV6/RUNX1 transcript is a target of RNA-binding protein IGF2BP1 in t(12;21)(p13;q22)-positive acute lymphoblastic leukemia.	RUNX1
26907657	10.1097/MPH.0000000000000545	2016	RUNX1 Amplification Increases the Risk for Thrombosis in Children With B-cell Acute Lymphoblastic Leukemia.	RUNX1
23772668	10.3109/10428194.2013.815351	2015	RUNX1-ETO induces a type I interferon response which negatively effects t(8;21)-induced increased self-renewal and leukemia development.	RUNX1
24144310	10.3109/10428194.2013.855311	2015	Identification of target genes using gene expression profile of granulocytes from patients with chronic myeloid leukemia treated with tyrosine kinase inhibitors.	RUNX1
24188477	10.3109/10428194.2013.861071	2015	Clinical outcome of the coexistence of ETV6/RUNX1 and high hyperdiploidy in pediatric acute lymphoblastic leukemia.	RUNX1
24241490	10.3324/haematol.2012.072470	2015	Copy number genome alterations are associated with treatment response and outcome in relapsed childhood ETV6/RUNX1-positive acute lymphoblastic leukemia.	RUNX1
24286261	10.3109/10428194.2013.869327	2015	Acute myeloid leukemia presenting with panhypopituitarism or diabetes insipidus: a case series with molecular genetic analysis and review of the literature.	RUNX1
24790906	10.3343/alm.2014.34.3.198	2015	Diagnostic utility of multiprobe fluorescence in situ hybridization assay for detecting cytogenetic aberrations in acute leukemia.	RUNX1
24816234	10.3324/haematol.2014.103820	2015	IGH@ translocations co-exist with other primary rearrangements in B-cell precursor acute lymphoblastic leukemia.	RUNX1
24897505	10.1038/leu.2014.177	2015	Evolutionary trajectories of hyperdiploid ALL in monozygotic twins.	RUNX1
24957142	10.1182/blood-2014-03-562918	2015	A novel integrated cytogenetic and genomic classification refines risk stratification in pediatric acute lymphoblastic leukemia.	RUNX1
25137060	10.1371/journal.pone.0104419	2015	Genomic inverse PCR for exploration of ligated breakpoints (GIPFEL), a new method to detect translocations in leukemia.	RUNX1
25150625	10.1016/j.bcmd.2014.07.011	2015	Concordant B-cell precursor acute lymphoblastic leukemia in non-twinned siblings.	RUNX1
25273558	10.1091/mbc.E14-06-1038	2015	Predicting interactome network perturbations in human cancer: application to gene fusions in acute lymphoblastic leukemia.	RUNX1
25312094	10.1111/bjh.13142	2015	Persistent MRD before and after allogeneic BMT predicts relapse in children with acute lymphoblastic leukaemia.	RUNX1
25355294	10.1002/humu.22719	2015	The mutational landscape in pediatric acute lymphoblastic leukemia deciphered by whole genome sequencing.	RUNX1
25388957	10.1038/leu.2014.322	2015	Clonal origins of ETV6-RUNX1⁺ acute lymphoblastic leukemia: studies in monozygotic twins.	RUNX1
25431866	10.1055/s-0034-1387795	2015	Minimal residual disease-based treatment is adequate for relapse-prone childhood acute lymphoblastic leukemia with an intrachromosomal amplification of chromosome 21: the experience of the ALL-BFM 2000 trial.	RUNX1
25444907	10.1016/j.canlet.2014.11.024	2015	Gene mutations in primary tumors and corresponding patient-derived xenografts derived from non-small cell lung cancer.	RUNX1
25678190	10.1016/j.cancergen.2014.11.003	2015	Integration of cytogenomic data for furthering the characterization of pediatric B-cell acute lymphoblastic leukemia: a multi-institution, multi-platform microarray study.	RUNX1
25692130	10.1155/2014/210560	2015	Prevalence of gene rearrangements in Mexican children with acute lymphoblastic leukemia: a population study-report from the Mexican Interinstitutional Group for the identification of the causes of childhood leukemia.	RUNX1
25873510	10.1309/AJCPUD6W1JLQQMNA	2015	Myeloid and lymphoid neoplasm with abnormalities of FGFR1 presenting with trilineage blasts and RUNX1 rearrangement: a case report and review of literature.	RUNX1
25948177	10.7534/j.issn.1009-2137.2015.02.004	2015	[Cytogenetic characteristics of 163 children with acute lymphoblastic leukemia].	RUNX1
25982135	10.1002/pbc.25583	2015	Clinical features and induction outcome of childhood acute lymphoblastic leukemia in a lower/middle income population: A multi-institutional report from Pakistan.	RUNX1
26071468	10.1309/AJCPLUYF11HQBYRB	2015	Cytogenetic Variation of B-Lymphoblastic Leukemia With Intrachromosomal Amplification of Chromosome 21 (iAMP21): A Multi-Institutional Series Review.	RUNX1
26185316	10.1309/AJCPVY5E5OMMYBFJ	2015	Heterogeneity of Abnormal RUNX1 Leading to Clinicopathologic Variations in Childhood B-Lymphoblastic Leukemia.	RUNX1
26189108	10.1016/j.leukres.2015.06.005	2015	Next-generation-sequencing of recurrent childhood high hyperdiploid acute lymphoblastic leukemia reveals mutations typically associated with high risk patients.	RUNX1
26304079	10.3760/cma.j.issn.0253-2727.2015.07.008	2015	[A case report of childhood acute lymphoblastic leukemia with intrachromosomal amplification of AML1 gene in chromosome 21 and TEL deletion].	RUNX1
23190578	10.1111/ijlh.12031	2014	Interphase-FISH screening for eight common rearrangements in pediatric B-cell precursor acute lymphoblastic leukemia.	RUNX1
23210573	10.3109/10428194.2012.754888	2014	Detection and clinical significance of gene rearrangements in Chinese patients with adult acute lymphoblastic leukemia.	RUNX1
23488608	10.3109/10428194.2013.786068	2014	The ETV6/RUNX1 fusion transcript is not detected in RNA isolated from neonatal dried blood spots from children later diagnosed with the corresponding leukemia.	RUNX1
23636228	10.1038/leu.2013.136	2014	Long-term follow-up of ETV6-RUNX1 ALL reveals that NCI risk, rather than secondary genetic abnormalities, is the key risk factor.	RUNX1
23672346	10.3109/10428194.2013.801469	2014	Acute myeloid leukemia with a novel t(8;21) variant: paracentric inversion-associated ins(21;8).	RUNX1
23679839	10.1111/cas.12199	2014	Roles of AML1/RUNX1 in T-cell malignancy induced by loss of p53.	RUNX1
23692290	10.1111/ejh.12147	2014	Concomitant germ-line RUNX1 and acquired ASXL1 mutations in a T-cell acute lymphoblastic leukemia.	RUNX1
23713453	10.3109/10428194.2013.805759	2014	Clinical significance of lymphoid enhancer-binding factor 1 expression in acute myeloid leukemia.	RUNX1
23716539	10.3324/haematol.2012.080432	2014	Clinico-biological features of 5202 patients with acute lymphoblastic leukemia enrolled in the Italian AIEOP and GIMEMA protocols and stratified in age cohorts.	RUNX1
23722552	10.1158/0008-5472.CAN-12-4367	2014	Integration of high-resolution methylome and transcriptome analyses to dissect epigenomic changes in childhood acute lymphoblastic leukemia.	RUNX1
23826571	10.3343/alm.2013.33.4.304	2014	The utility of the multiplex reverse transcriptase-polymerase chain reaction assay in the detection of hematologic malignancies.	RUNX1
23911702	10.3324/haematol.2013.090225	2014	High CD45 surface expression determines relapse risk in children with precursor B-cell and T-cell acute lymphoblastic leukemia treated according to the ALL-BFM 2000 protocol.	RUNX1
23940019	10.1002/pbc.24584	2014	Clinical characteristics and treatment outcome of childhood acute lymphoblastic leukemia in Saudi Arabia: a multi-institutional retrospective national collaborative study.	RUNX1
23940220	10.1200/JCO.2013.48.9377	2014	Risk-directed treatment intensification significantly reduces the risk of relapse among children and adolescents with acute lymphoblastic leukemia and intrachromosomal amplification of chromosome 21: a comparison of the MRC ALL97/99 and UKALL2003 trials.	RUNX1
23940221	10.1200/JCO.2013.49.1308	2014	Intrachromosomal amplification of chromosome 21 is associated with inferior outcomes in children with acute lymphoblastic leukemia treated in contemporary standard-risk children's oncology group studies: a report from the children's oncology group.	RUNX1
24006408	10.3324/haematol.2013.090860	2014	Clone-specific secondary aberrations are not detected in neonatal blood spots of children with ETV6-RUNX1-positive leukemia.	RUNX1
24045615	10.1093/hmg/ddt447	2014	Frequent and sex-biased deletion of SLX4IP by illegitimate V(D)J-mediated recombination in childhood acute lymphoblastic leukemia.	RUNX1
24052438	10.1007/s13277-013-1192-2	2014	Applicability of gene expression profile of childhood acute lymphoblastic leukemia at diagnosis and at the end of the induction phase of chemotherapy at a cancer hospital in the state of Goiás (Brazil).	RUNX1
24076604	10.1038/ng.2777	2014	Global chromatin profiling reveals NSD2 mutations in pediatric acute lymphoblastic leukemia.	RUNX1
24123676	10.1002/gcc.22105	2014	Identification of a novel fusion gene involving RUNX1 and the antisense strand of SV2B in a BCR-ABL1-positive acute leukemia.	RUNX1
24140475	10.1016/j.cellsig.2013.09.021	2014	New insights into Notch1 regulation of the PI3K-AKT-mTOR1 signaling axis: targeted therapy of γ-secretase inhibitor resistant T-cell acute lymphoblastic leukemia.	RUNX1
24166298	10.1038/leu.2013.317	2014	An international study of intrachromosomal amplification of chromosome 21 (iAMP21): cytogenetic characterization and outcome.	RUNX1
24222333	10.1182/blood-2013-06-509463	2014	Acute lymphoblastic leukemia in children with Down syndrome: a retrospective analysis from the Ponte di Legno study group.	RUNX1
24231528	10.1016/j.leukres.2013.10.008	2014	Significance of CD66c expression in childhood acute lymphoblastic leukemia.	RUNX1
24235135	10.1182/blood-2013-07-453480	2014	How I treat ALL in Down's syndrome: pathobiology and management.	RUNX1
24240203	10.1038/leu.2013.345	2014	Blocking ETV6/RUNX1-induced MDM2 overexpression by Nutlin-3 reactivates p53 signaling in childhood leukemia.	RUNX1
24319172	10.1182/asheducation-2013.1.118	2014	Targeting signaling pathways in acute lymphoblastic leukemia: new insights.	RUNX1
24327541	10.1002/gcc.22124	2014	The role of topoisomerase II beta on breakage and proximity of RUNX1 to partner alleles RUNX1T1 and EVI1.	RUNX1
24339741	10.1593/neo.131310	2014	ETV6/RUNX1 induces reactive oxygen species and drives the accumulation of DNA damage in B cells.	RUNX1
24394348	10.4161/epi.27585	2014	Epigenetic deregulation in pediatric acute lymphoblastic leukemia.	RUNX1
24413735	10.1038/ng.2874	2014	RAG-mediated recombination is the predominant driver of oncogenic rearrangement in ETV6-RUNX1 acute lymphoblastic leukemia.	RUNX1
24473322	10.1038/ng.2879	2014	A RAG driver on the road to pediatric ALL.	RUNX1
24557455	10.1159/000356778	2014	ETV6/RUNX1 rearrangement identified by RT-PCR without evidence on FISH.	RUNX1
24574234	10.1002/art.38264	2014	Genome-wide DNA methylation patterns in naive CD4+ T cells from patients with primary Sjögren's syndrome.	RUNX1
24596209	10.1158/2159-8290.CD-RW2014-018	2014	ETV6-RUNX1-positive ALL may be driven by aberrant RAG activity.	RUNX1
24648275	10.1002/pbc.25031	2014	Childhood acute lymphoblastic leukemia in the Middle East and neighboring countries: a prospective multi-institutional international collaborative study (CALLME1) by the Middle East Childhood Cancer Alliance (MECCA).	RUNX1
24740533	10.1002/pbc.25050	2014	False positivity of ETV6/RUNX1 detected by FISH in healthy newborns and adults.	RUNX1
24792891	10.1016/j.gene.2014.04.074	2014	RUNX1 point mutations potentially identify a subset of early immature T-cell acute lymphoblastic leukaemia that may originate from differentiated T-cells.	RUNX1
24898268	10.1124/jpet.114.214742	2014	3,3'-diindolylmethane ameliorates experimental autoimmune encephalomyelitis by promoting cell cycle arrest and apoptosis in activated T cells through microRNA signaling pathways.	RUNX1
24998463	10.1016/j.cancergen.2014.05.003	2014	High frequency of BTG1 deletions in patients with BCR-ABL1-positive acute leukemia.	RUNX1
25043025	10.1038/nature13393	2014	Targeting transcription regulation in cancer with a covalent CDK7 inhibitor.	RUNX1
25394790	10.1126/science.1259037	2014	Oncogene regulation. An oncogenic super-enhancer formed through somatic mutation of a noncoding intergenic element.	RUNX1
22359517	10.1371/journal.pgen.1002533	2013	The origin and nature of tightly clustered BTG1 deletions in precursor B-cell acute lymphoblastic leukemia support a model of multiclonal evolution.	RUNX1
22528566	10.1007/s12253-012-9533-9	2013	Six cases of rare gene amplifications and multiple copy of fusion gene in childhood acute lymphoblastic leukemia.	RUNX1
22580999	10.3324/haematol.2011.059584	2013	Excellent prognosis of late relapses of ETV6/RUNX1-positive childhood acute lymphoblastic leukemia: lessons from the FRALLE 93 protocol.	RUNX1
22699455	10.1038/leu.2012.155	2013	Prognostic value of genetic alterations in children with first bone marrow relapse of childhood B-cell precursor acute lymphoblastic leukemia.	RUNX1
22705992	10.1038/leu.2012.161	2013	Prognostic significance of FLT3 mutational status and expression levels in MLL-AF4+ and MLL-germline acute lymphoblastic leukemia.	RUNX1
22828445	10.1038/leu.2012.211	2013	EVI-1 modulates leukemogenic potential and apoptosis sensitivity in human acute lymphoblastic leukemia.	RUNX1
22897724	10.3109/10428194.2012.710330	2013	Gene expression pattern contributing to prognostic factors in childhood acute lymphoblastic leukemia.	RUNX1
22976839	10.1007/s10552-012-0060-5	2013	NQO1 rs1800566 (C609T), PON1 rs662 (Q192R), and PON1 rs854560 (L55M) polymorphisms segregate the risk of childhood acute leukemias according to age range distribution.	RUNX1
22994759	10.7314/apjcp.2012.13.7.3349	2013	Prognostically significant fusion oncogenes in Pakistani patients with adult acute lymphoblastic leukemia and their association with disease biology and outcome.	RUNX1
23022380	10.1016/j.molcel.2012.08.022	2013	NOTCH1 nuclear interactome reveals key regulators of its transcriptional activity and oncogenic function.	RUNX1
23077088	10.1002/gcc.22021	2013	Abnormalities of the der(12)t(12;21) in ETV6-RUNX1 acute lymphoblastic leukemia.	RUNX1
23086478	10.1038/nm.2960	2013	NOTCH1 promotes T cell leukemia-initiating activity by RUNX-mediated regulation of PKC-θ and reactive oxygen species.	RUNX1
23135987	10.1002/stem.1277	2013	TEL (ETV6)-AML1 (RUNX1) initiates self-renewing fetal pro-B cells in association with a transcriptional program shared with embryonic stem cells in mice.	RUNX1
23171811	10.1159/000342490	2013	Variant of ETV6/ABL1 gene is associated with leukemia phenotype.	RUNX1
23233609	10.1182/asheducation-2012.1.389	2013	The molecular genetic makeup of acute lymphoblastic leukemia.	RUNX1
23298878	10.1097/MOH.0b013e32835d82fe	2013	Polycythemia vera and essential thrombocythemia: new developments in biology with therapeutic implications.	RUNX1
23317202	10.7314/apjcp.2012.13.11.5469	2013	Five most common prognostically important fusion oncogenes are detected in the majority of Pakistani pediatric acute lymphoblastic leukemia patients and are strongly associated with disease biology and treatment outcome.	RUNX1
23341344	10.1002/gcc.22039	2013	The molecular profile of adult T-cell acute lymphoblastic leukemia: mutations in RUNX1 and DNMT3A are associated with poor prognosis in T-ALL.	RUNX1
23352661	10.1016/j.celrep.2012.12.016	2013	RUNX1 is a key target in t(4;11) leukemias that contributes to gene activation through an AF4-MLL complex interaction.	RUNX1
23443342	10.1038/leu.2013.15	2013	Initially disadvantaged, TEL-AML1 cells expand and initiate leukemia in response to irradiation and cooperating mutations.	RUNX1
23491079	10.1016/j.cancergen.2013.01.004	2013	Simultaneous occurrence of ETV6-RUNX1 and BCR-ABL1 (e1a2) transcripts in a child with B-cell acute lymphoblastic leukemia.	RUNX1
23694795		2013	Hemophagocytosis by leukemic blasts in B lymphoblastic leukemia with t(12;21)(p13;q22); TEL-AML1 (ETV6-RUNX1): a case report.	RUNX1
23704093	10.1182/blood-2013-01-480244	2013	Runx1 is essential at two stages of early murine B-cell development.	RUNX1
23741012	10.1182/blood-2012-11-465252	2013	STAT3 mediates oncogenic addiction to TEL-AML1 in t(12;21) acute lymphoblastic leukemia.	RUNX1
23857984	10.1084/jem.20122516	2013	The TAL1 complex targets the FBXW7 tumor suppressor by activating miR-223 in human T cell acute lymphoblastic leukemia.	RUNX1
23859904	10.1016/j.cancergen.2013.05.017	2013	Frequency of the ETV6-RUNX1, BCR-ABL1, TCF3-PBX1, and MLL-AFF1 fusion genes in Guatemalan pediatric acute lymphoblastic leukemia patients and their ethnic associations.	RUNX1
23915977	10.1016/j.leukres.2013.06.027	2013	MiR-125b, miR-100 and miR-99a co-regulate vincristine resistance in childhood acute lymphoblastic leukemia.	RUNX1
24081948	10.1084/jem.20130497	2013	Aberrant ZNF423 impedes B cell differentiation and is linked to adverse outcome of ETV6-RUNX1 negative B precursor acute lymphoblastic leukemia.	RUNX1
21569007	10.1111/j.1365-2141.2011.08729.x	2012	Native ETV6 deletions accompanied by ETV6-RUNX1 rearrangements are associated with a favourable prognosis in childhood acute lymphoblastic leukaemia: a candidate for prognostic marker.	RUNX1
21749308	10.3109/10428194.2011.594927	2012	A novel t(7;21)(q32;q22) translocation disrupting the RUNX1 gene in an adult patient with acute myeloid leukemia.	RUNX1
21822204	10.1038/modpathol.2011.118	2012	Pediatric B-lymphoblastic leukemia with RUNX1 amplification: clinicopathologic study of eight cases.	RUNX1
21828118	10.3324/haematol.2011.043919	2012	Prognostic relevance of RUNX1 mutations in T-cell acute lymphoblastic leukemia.	RUNX1
21869842	10.1038/leu.2011.227	2012	ETV6-RUNX1-positive childhood acute lymphoblastic leukemia: improved outcome with contemporary therapy.	RUNX1
21877899	10.3109/10428194.2011.618235	2012	Update on cytogenetic and molecular changes in myelodysplastic syndromes.	RUNX1
21914494	10.1016/j.exphem.2011.08.014	2012	hTERT promoter methylation and telomere length in childhood acute lymphoblastic leukemia: associations with immunophenotype and cytogenetic subgroup.	RUNX1
22005784	10.1038/leu.2011.274	2012	High concordance of subtypes of childhood acute lymphoblastic leukemia within families: lessons from sibships with multiple cases of leukemia.	RUNX1
22015773	10.1038/leu.2011.278	2012	Connectivity mapping identifies HDAC inhibitors for the treatment of t(4;11)-positive infant acute lymphoblastic leukemia.	RUNX1
22028862	10.1371/journal.pone.0026348	2012	The leukemia-specific fusion gene ETV6/RUNX1 perturbs distinct key biological functions primarily by gene repression.	RUNX1
22058208	10.3324/haematol.2011.049593	2012	Epigenetic inactivation of TWIST2 in acute lymphoblastic leukemia modulates proliferation, cell survival and chemosensitivity.	RUNX1
22076464	10.1038/leu.2011.302	2012	Identification of germline susceptibility loci in ETV6-RUNX1-rearranged childhood acute lymphoblastic leukemia.	RUNX1
22094584	10.1038/leu.2011.333	2012	Whole-exome sequencing of pediatric acute lymphoblastic leukemia.	RUNX1
22094587	10.1038/leu.2011.322	2012	Silencing of ETV6/RUNX1 abrogates PI3K/AKT/mTOR signaling and impairs reconstitution of leukemia in xenografts.	RUNX1
22145956	10.3109/10428194.2011.647314	2012	Systemic mastocytosis is uncommon in KIT D816V mutation positive core-binding factor acute myeloid leukemia.	RUNX1
22163048	10.1371/journal.pone.0028638	2012	Upregulation of the cell-cycle regulator RGC-32 in Epstein-Barr virus-immortalized cells.	RUNX1
22215484	10.1007/s12185-011-0981-x	2012	Childhood B-cell progenitor acute lymphoblastic leukemia presenting a three-way t(11;12;21)(q14;p13;q22) with a RUNX1 gene signal on chromosome 11.	RUNX1
22217495	10.1097/MPH.0b013e3182332268	2012	RT-PCR screening for ETV6-RUNX1-positive clones in cord blood from newborns in the Danish National Birth Cohort.	RUNX1
22226019	10.1016/j.leukres.2011.12.003	2012	RT-PCR diagnosis of recurrent rearrangements in pediatric acute lymphoblastic leukemia in Argentina.	RUNX1
22237106	10.1038/nature10725	2012	The genetic basis of early T-cell precursor acute lymphoblastic leukaemia.	RUNX1
22260162	10.3109/10428194.2012.658570	2012	Clinical impact of in vitro cellular drug resistance on childhood acute lymphoblastic leukemia in Taiwan.	RUNX1
22362744	10.1093/nar/gks175	2012	MicroRNA and transcription factor co-regulatory network analysis reveals miR-19 inhibits CYLD in T-cell acute lymphoblastic leukemia.	RUNX1
22366949	10.1038/nm.2610	2012	Reverse engineering of TLX oncogenic transcriptional networks identifies RUNX1 as tumor suppressor in T-ALL.	RUNX1
22373549	10.1007/s00277-012-1431-4	2012	Detection of ETV6 gene rearrangements in adult acute lymphoblastic leukemia.	RUNX1
22382891	10.1038/leu.2012.26	2012	Newly diagnosed acute lymphoblastic leukemia in China (I): abnormal genetic patterns in 1346 childhood and adult cases and their comparison with the reports from Western countries.	RUNX1
22404039	10.1111/j.1365-2141.2012.09083.x	2012	Genome-wide analysis of cytogenetic aberrations in ETV6/RUNX1-positive childhood acute lymphoblastic leukaemia.	RUNX1
22449370	10.1016/j.disamonth.2012.01.011	2012	Adult acute leukemia.	RUNX1
22450142	10.1556/OH.2012.29334	2012	[Leukemia- and lymphoma-associated flow cytometric, cytogenetic, and molecular genetic aberrations in healthy individuals].	RUNX1
22514921		2012	[Radiation associated leukemia and myelodysplastic syndrome].	RUNX1
22521551	10.1016/j.leukres.2012.03.024	2012	Additional aberrations of the ETV6 and RUNX1 genes have no prognostic impact in 229 t(12;21)(p13;q22)-positive B-cell precursor acute lymphoblastic leukaemias treated according to the NOPHO-ALL-2000 protocol.	RUNX1
22531296	10.4161/epi.20193	2012	A distinct DNA methylation signature defines pediatric pre-B cell acute lymphoblastic leukemia.	RUNX1
22569278	10.1097/MCD.0b013e32835431fd	2012	One in 10 million: a case of cleidocranial dysplasia and acute lymphoblastic leukaemia--more than just a coincidence?	RUNX1
22748822	10.1016/j.leukres.2012.05.019	2012	Expression of RUNX1 isoforms and its target gene BLK in childhood acute lymphoblastic leukemia.	RUNX1
22897851	10.1016/j.ccr.2012.06.007	2012	Core transcriptional regulatory circuit controlled by the TAL1 complex in human T cell acute lymphoblastic leukemia.	RUNX1
22912405	10.1073/pnas.1200037109	2012	Identification of benzodiazepine Ro5-3335 as an inhibitor of CBF leukemia through quantitative high throughput screen against RUNX1-CBFβ interaction.	RUNX1
19698265		2011	[Aml1 gene abnormality in pediatric acute leukemia-review].	RUNX1
20713965	10.1182/blood-2010-05-282764	2011	Prevalence of t(12;21)[ETV6-RUNX1]-positive cells in healthy neonates.	RUNX1
20807887	10.1182/blood-2009-02-206706	2011	TEL-AML1 regulation of survivin and apoptosis via miRNA-494 and miRNA-320a.	RUNX1
20846103	10.3109/10428194.2010.503821	2011	Identification and molecular characterization of a novel 3&amp;#x2032; mutation in RUNX1 in a family with familial platelet disorder.	RUNX1
20880108	10.1111/j.1365-2141.2010.08370.x	2011	Childhood B-cell precursor acute lymphoblastic leukaemia in a patient with familial thrombocytopenia and RUNX1 mutation.	RUNX1
20958258	10.2174/1386207311107010036	2011	OPLS-DA as a suitable method for selecting a set of gene transcripts discriminating RAS- and PTPN11-mutated cells in acute lymphoblastic leukaemia.	RUNX1
21054152	10.3109/10428194.2010.522286	2011	RUNX1-MTG16 fusion gene in de novo acute myeloblastic leukemia with t(16;21)(q24;q22).	RUNX1
21145270	10.1016/j.bcmd.2010.11.003	2011	Febrile infections in young children do not frequently induce translocation ETV6-RUNX1.	RUNX1
21152005	10.1371/journal.pcbi.1001019	2011	Modeling mechanisms of in vivo variability in methotrexate accumulation and folate pathway inhibition in acute lymphoblastic leukemia cells.	RUNX1
21160474	10.1038/nature09650	2011	Genetic variegation of clonal architecture and propagating cells in leukaemia.	RUNX1
21172890	10.1200/JCO.2010.32.0325	2011	Improved prognosis for older adolescents with acute lymphoblastic leukemia.	RUNX1
21212293	10.1182/blood-2010-09-309070	2011	ETV6/RUNX1 (TEL/AML1) is a frequent prenatal first hit in childhood leukemia.	RUNX1
