pmid	doi	year	title	Hugo_Symbol
21224468	10.1182/blood-2010-03-275347	2011	ETV6/RUNX1-positive relapses evolve from an ancestral clone and frequently acquire deletions of genes implicated in glucocorticoid signaling.	RUNX1
21249144	10.1371/journal.pone.0016171	2011	Identification of genes that elicit disuse muscle atrophy via the transcription factors p50 and Bcl-3.	RUNX1
21414819	10.1016/j.bcmd.2011.02.005	2011	Identification of characteristic IGF2BP expression patterns in distinct B-ALL entities.	RUNX1
21425961	10.3109/10428194.2011.566391	2011	Activation of Paired-homeobox gene PITX1 by del(5)(q31) in T-cell acute lymphoblastic leukemia.	RUNX1
21444869	10.1200/JCO.2010.32.5340	2011	Shortening infusion time for high-dose methotrexate alters antileukemic effects: a randomized prospective clinical trial.	RUNX1
21482711	10.1182/blood-2010-10-314674	2011	Clonal origins of relapse in ETV6-RUNX1 acute lymphoblastic leukemia.	RUNX1
21487021	10.1093/hmg/ddr159	2011	Analysis of a breakpoint cluster reveals insight into the mechanism of intrachromosomal amplification in a lymphoid malignancy.	RUNX1
21527530	10.1182/blood-2011-01-329961	2011	Genomic characterization implicates iAMP21 as a likely primary genetic event in childhood B-cell precursor acute lymphoblastic leukemia.	RUNX1
21549623	10.1016/j.bcmd.2011.04.003	2011	PAX5 deletion is common and concurrently occurs with CDKN2A deletion in B-lineage acute lymphoblastic leukemia.	RUNX1
21628403	10.1182/blood-2011-02-338848	2011	Modeling the evolution of ETV6-RUNX1-induced B-cell precursor acute lymphoblastic leukemia in mice.	RUNX1
21657952	10.3109/10428194.2011.576286	2011	A complex karyotype masked a cryptic variant t(8;21)(q22;q22) in a child with acute myeloid leukemia.	RUNX1
21705495	10.1182/blood-2010-12-326199	2011	HTLV-1 bZIP factor enhances TGF-β signaling through p300 coactivator.	RUNX1
21738341	10.3346/jkms.2011.26.7.886	2011	Spectra of chromosomal aberrations in 325 leukemia patients and implications for the development of new molecular detection systems.	RUNX1
18928518	10.1186/1756-8722-1-17	2010	Persistence of TEL-AML1 fusion gene as minimal residual disease has no additive prognostic value in CD 10 positive B-acute lymphoblastic leukemia: a FISH study.	RUNX1
19710699	10.1038/leu.2009.170	2010	Characterizing chromosomal break points of t(12;21)[ETV6-RUNX1]-positive leukaemia using multiple tiling PCR on whole-genome-amplified DNA.	RUNX1
19713226	10.3324/haematol.2009.011346	2010	Clinical features and prognostic implications of TCF3-PBX1 and ETV6-RUNX1 in adult acute lymphoblastic leukemia.	RUNX1
19890372	10.1038/leu.2009.208	2010	Hsa-mir-125b-2 is highly expressed in childhood ETV6/RUNX1 (TEL/AML1) leukemias and confers survival advantage to growth inhibitory signals independent of p53.	RUNX1
19893343	10.3343/kjlm.2009.29.5.371	2010	[Clinical utility of fluorescence in-situ hybridization profile test in detecting genetic aberrations in acute leukemia].	RUNX1
19896186	10.1016/j.leukres.2009.09.033	2010	CD9 expression can be used to predict childhood TEL/AML1-positive acute lymphoblastic leukemia: proposal for an accelerated diagnostic flowchart.	RUNX1
19927343	10.1002/jcla.20343	2010	AML1 amplification and 17q25 deletion in a case of childhood acute lymphoblastic leukemia.	RUNX1
19998443	10.1002/gcc.20736	2010	Cytogenetics of long-term survivors of ETV6-RUNX1 fusion positive acute lymphoblastic leukemia.	RUNX1
20001230	10.3109/10428190903350397	2010	Genetic changes including gene copy number alterations and their relation to prognosis in childhood acute myeloid leukemia.	RUNX1
20001241	10.3109/10428190903456967	2010	RUNX1 amplification in B-cell acute lymphoblastic leukemia.	RUNX1
20016529	10.1038/leu.2009.264	2010	Temporal changes in the incidence and pattern of central nervous system relapses in children with acute lymphoblastic leukaemia treated on four consecutive Medical Research Council trials, 1985-2001.	RUNX1
20016538	10.1038/leu.2009.248	2010	Long-term results of Taiwan Pediatric Oncology Group studies 1997 and 2002 for childhood acute lymphoblastic leukemia.	RUNX1
20042721	10.1182/blood-2009-09-235986	2010	Immunoglobulin heavy chain locus chromosomal translocations in B-cell precursor acute lymphoblastic leukemia: rare clinical curios or potent genetic drivers?	RUNX1
20061556	10.1182/blood-2009-10-251413	2010	Acquisition of genome-wide copy number alterations in monozygotic twins with acute lymphoblastic leukemia.	RUNX1
20197715	10.3343/kjlm.2010.30.1.1	2010	[Prognostic significance of TEL/AML1 rearrangement and its additional genetic changes in Korean childhood precursor B-acute lymphoblastic leukemia].	RUNX1
20211010	10.1186/1755-8794-3-6	2010	Gene expression signatures in childhood acute leukemias are largely unique and distinct from those of normal tissues and other malignancies.	RUNX1
20409752	10.1016/S1470-2045(10)70066-8	2010	Prognostic effect of chromosomal abnormalities in childhood B-cell precursor acute lymphoblastic leukaemia: results from the UK Medical Research Council ALL97/99 randomised trial.	RUNX1
20442364	10.1182/blood-2009-07-235291	2010	Down syndrome childhood acute lymphoblastic leukemia has a unique spectrum of sentinel cytogenetic lesions that influences treatment outcome: a report from the Children's Oncology Group.	RUNX1
20513752	10.1093/hmg/ddq224	2010	The correlation pattern of acquired copy number changes in 164 ETV6/RUNX1-positive childhood acute lymphoblastic leukemias.	RUNX1
20538338	10.1016/j.leukres.2010.05.012	2010	Folylpolyglutamate synthetase gene transcription is regulated by a multiprotein complex that binds the TEL-AML1 fusion in acute lymphoblastic leukemia.	RUNX1
20549580	10.1007/s12185-010-0612-y	2010	T cell acute lymphoblastic leukemia arising from familial platelet disorder.	RUNX1
20561032	10.1111/j.1600-0609.2010.01493.x	2010	Childhood near-tetraploid acute lymphoblastic leukemia: an EGIL study on 36 cases.	RUNX1
20587518	10.1158/0008-5472.CAN-10-0726	2010	Runx regulation of sphingolipid metabolism and survival signaling.	RUNX1
20594594	10.1016/j.leukres.2010.05.033	2010	Old drug--new insights--better treatment?	RUNX1
20620598	10.1016/j.cancergencyto.2010.04.010	2010	Distribution of common genetic subgroups in childhood acute lymphoblastic leukemia in four developing countries.	RUNX1
20658612	10.1002/pbc.22628	2010	Frequencies of ETV6-RUNX1 fusion and hyperdiploidy in pediatric acute lymphoblastic leukemia are lower in far east than west.	RUNX1
20686504	10.1038/leu.2010.155	2010	Leukemic fusion genes MLL/AF4 and AML1/MTG8 support leukemic self-renewal by controlling expression of the telomerase subunit TERT.	RUNX1
20701601	10.1111/j.1365-2141.2010.08314.x	2010	Detection of prognostically relevant genetic abnormalities in childhood B-cell precursor acute lymphoblastic leukaemia: recommendations from the Biology and Diagnosis Committee of the International Berlin-Frankfürt-Münster study group.	RUNX1
20930648	10.1097/MPH.0b013e3181ed1655	2010	Multiplex reverse transcription-polymerase chain reaction as diagnostic molecular screening of 4 common fusion chimeric genes in Taiwanese children with acute lymphoblastic leukemia.	RUNX1
18728978	10.1080/08880010802237450	2009	RUNX1 aberrations in ETV6/RUNX1-positive and ETV6/RUNX1-negative patients: its hemato-pathological and prognostic significance in a large cohort (619 cases) of ALL.	RUNX1
19100516	10.1016/j.cancergencyto.2008.09.005	2009	ETV6/RUNX1 fusion lacking prognostic effect in pediatric patients with acute lymphoblastic leukemia.	RUNX1
19129484	10.1189/jlb.0808469	2009	Histone deacetylase inhibition improves differentiation of dendritic cells from leukemic blasts of patients with TEL/AML1-positive acute lymphoblastic leukemia.	RUNX1
19151769	10.1038/leu.2008.350	2009	Overexpression of an isoform of AML1 in acute leukemia and its potential role in leukemogenesis.	RUNX1
19403666	10.1128/JVI.00216-09	2009	Downregulation of RUNX1 by RUNX3 requires the RUNX3 VWRPY sequence and is essential for Epstein-Barr virus-driven B-cell proliferation.	RUNX1
19665068	10.1016/j.cancergencyto.2009.04.021	2009	ETV6-RUNX1 fusion gene and additional genetic changes in infant leukemia: a genome-wide analysis.	RUNX1
19837270	10.1016/j.cancergencyto.2009.06.013	2009	Homozygous deletion of CDKN2A (p16, p14) and CDKN2B (p15) genes is a poor prognostic factor in adult but not in childhood B-lineage acute lymphoblastic leukemia: a comparative deletion and hypermethylation study.	RUNX1
17956600	10.1186/1471-2164-8-385	2008	Five distinct biological processes and 14 differentially expressed genes characterize TEL/AML1-positive leukemia.	RUNX1
18202291	10.1126/science.1150648	2008	Initiating and cancer-propagating cells in TEL-AML1-associated childhood leukemia.	RUNX1
18206538	10.1016/j.cancergencyto.2007.10.004	2008	Multiple copies of RUNX1: description of 14 new patients, follow-up, and a review of the literature.	RUNX1
18445843	10.1200/JCO.2007.14.3552	2008	Prospective analysis of TEL gene rearrangements in childhood acute lymphoblastic leukemia: a Children's Oncology Group study.	RUNX1
18539581	10.1556/OH.2008.28388	2008	[Intrachromosomal amplification of AML1 gene in childhood acute lymphoblastic leukemia].	RUNX1
18635414	10.1016/S1607-551X(08)70155-4	2008	TEL/AML1 fusion gene in childhood acute lymphoblastic leukemia in southern Taiwan.	RUNX1
18767146	10.1002/gcc.20613	2008	The complex genomic profile of ETV6-RUNX1 positive acute lymphoblastic leukemia highlights a recurrent deletion of TBL1XR1.	RUNX1
16386788	10.1016/j.leukres.2005.11.007	2007	The incidence of T-cell receptor gene rearrangements in childhood B-lineage acute lymphoblastic leukemia is related to immunophenotype and fusion oncogene expression.	RUNX1
16673018	10.1038/sj.leu.2404249	2007	A novel TEL-AML1 fusion transcript involving the pro-apoptotic gene BCL-G in pediatric precursor B acute lymphoblastic leukemia.	RUNX1
17673463	10.1074/jbc.M706314200	2007	Hepatocyte growth factor receptor c-MET is associated with FAS and when activated enhances drug-induced apoptosis in pediatric B acute lymphoblastic leukemia with TEL-AML1 translocation.	RUNX1
17690704	10.1038/sj.leu.2404879	2007	Combined high-resolution array-based comparative genomic hybridization and expression profiling of ETV6/RUNX1-positive acute lymphoblastic leukemias reveal a high incidence of cryptic Xq duplications and identify several putative target genes within the commonly gained region.	RUNX1
17889709	10.1016/j.cancergencyto.2007.05.019	2007	Prevalence of ETV6-RUNX1 fusion gene in children with acute lymphoblastic leukemia in China.	RUNX1
17889714	10.1016/j.cancergencyto.2007.06.015	2007	RUNX1 amplification in lineage conversion of childhood B-cell acute lymphoblastic leukemia to acute myelogenous leukemia.	RUNX1
15970674	10.4161/cc.4.8.1860	2006	TELAML1-positive ALL: a discordant genotype.	RUNX1
16278392	10.1158/1078-0432.CCR-05-1239	2006	Immunogenotype changes prevail in relapses of young children with TEL-AML1-positive acute lymphoblastic leukemia and derive mainly from clonal selection.	RUNX1
16307024	10.1038/sj.leu.2404028	2006	Expression of Tel-Aml1 transcript variants in pediatric acute lymphoblastic leukemia.	RUNX1
16914570	10.1158/1078-0432.CCR-05-2592	2006	CpG island methylator phenotype redefines the prognostic effect of t(12;21) in childhood acute lymphoblastic leukemia.	RUNX1
17015828	10.1073/pnas.0603349103	2006	TEL-AML1 transgenic zebrafish model of precursor B cell acute lymphoblastic leukemia.	RUNX1
15704129	10.1002/gcc.20158	2005	ETV6/RUNX1 fusion at diagnosis and relapse: some prognostic indications.	RUNX1
15991223	10.1002/hon.734	2005	Increased expression of AML1-a and acquired chromosomal abnormalities in childhood acute lymphoblastic leukemia.	RUNX1
16213368	10.1016/j.cancergencyto.2005.02.020	2005	The presence of TEL/AML1 rearrangement and cryptic deletion of the TEL gene in adult acute lymphoblastic leukemia (ALL).	RUNX1
14523475	10.1038/sj.leu.2403140	2004	Amplification of AML1 in acute lymphoblastic leukemia is associated with a poor outcome.	RUNX1
15061191	10.1080/1042819031000139611	2004	Familial mutations of the transcription factor RUNX1 (AML1, CBFA2) predispose to acute myeloid leukemia.	RUNX1
15104277	10.1016/s0165-4608(03)00259-0	2004	Chromosome 21 tandem repetition and AML1 (RUNX1) gene amplification.	RUNX1
15104290	10.1016/j.cancergencyto.2003.07.003	2004	Cloning and sequencing of ETV6/RUNX1 (TEL/AML1) variant in acute lymphoblastic leukemia.	RUNX1
15142881	10.1182/blood-2003-12-4306	2004	Acute lymphoblastic leukemia with TEL-AML1 fusion has lower expression of genes involved in purine metabolism and lower de novo purine synthesis.	RUNX1
12002768	10.1080/10428190290012155	2003	Mutational analyses of the AML1 gene in patients with myelodysplastic syndrome.	RUNX1
12526921	10.1016/s0145-2126(02)00183-2	2003	TEL-AML1 fusion precedes differentiation to pre-B cells in childhood acute lymphoblastic leukemia.	RUNX1
12072207	10.1016/s0165-4608(01)00633-1	2002	A new translocation that rearranges the AML1 gene in a patient with T-cell acute lymphoblastic leukemia.	RUNX1
12091359	10.1182/blood.v100.2.640	2002	Immature CD34+CD19- progenitor/stem cells in TEL/AML1-positive acute lymphoblastic leukemia are genetically and functionally normal.	RUNX1
12393286	10.1016/s0165-4608(02)00566-6	2002	AML1 amplification in a case of childhood acute lymphoblastic leukemia.	RUNX1
7761424	10.1073/pnas.92.11.4917	1995	Fusion of the TEL gene on 12p13 to the AML1 gene on 21q22 in acute lymphoblastic leukemia.	RUNX1
7780150		1995	The t(12;21) of acute lymphoblastic leukemia results in a tel-AML1 gene fusion.	RUNX1
