pmid	doi	year	title	Hugo_Symbol
11594748	10.1006/bbrc.2001.5723	2001	PKCdelta and zeta mediate IL-4/IL-13-induced germline epsilon transcription in human B cells: a putative regulation via PU.1 phosphorylation.	STAT6
11675351	10.1182/blood.v98.9.2778	2001	Interleukin-7 and interleukin-15 regulate the expression of the bcl-2 and c-myb genes in cutaneous T-cell lymphoma cells.	STAT6
11708812	10.1006/bbrc.2001.5968	2001	CD40 employs p38 MAP kinase in IgE isotype switching.	STAT6
11815733	10.1159/000049523	2001	Interleukin 13: a growth factor in hodgkin lymphoma.	STAT6
10744706	10.1074/jbc.275.14.10212	2000	Interleukin-4 mediates cell growth inhibition through activation of Stat1.	STAT6
10856136	10.1067/mai.2000.107604	2000	IL-4/IL-13 signaling beyond JAK/STAT.	STAT6
10369418	10.1016/s0161-5890(98)00114-x	1999	Regulation of the germline immunoglobulin Cgamma1 promoter by CD40 ligand and IL-4: dual role for tandem NF-kappaB binding sites.	STAT6
10572070	10.1165/ajrcmb.21.6.3709	1999	Homologous human and murine antisense oligonucleotides targeting stat6. Functional effects on germline cepsilon transcript.	STAT6
10626250	10.3109/08830189909088490	1999	Regulation of lymphocyte cell fate decisions and lymphomagenesis by BCL-6.	STAT6
9545332	10.1074/jbc.273.16.9898	1998	A role for the insulin-interleukin (IL)-4 receptor motif of the IL-4 receptor alpha-chain in regulating activation of the insulin receptor substrate 2 and signal transducer and activator of transcription 6 pathways. Analysis by mutagenesis.	STAT6
9584180	10.1128/MCB.18.6.3395	1998	Interaction of stat6 and NF-kappaB: direct association and synergistic activation of interleukin-4-induced transcription.	STAT6
9110977	10.1126/science.276.5312.589	1997	Control of inflammation, cytokine expression, and germinal center formation by BCL-6.	STAT6
9144491		1997	CD40 cross-linking induces Ig epsilon germline transcripts in B cells via activation of NF-kappaB: synergy with IL-4 induction.	STAT6
9159166	10.1073/pnas.94.11.5866	1997	Homodimerization of the human interleukin 4 receptor alpha chain induces Cepsilon germline transcripts in B cells in the absence of the interleukin 2 receptor gamma chain.	STAT6
9192639	10.1073/pnas.94.13.6764	1997	Constitutive activation of a slowly migrating isoform of Stat3 in mycosis fungoides: tyrphostin AG490 inhibits Stat3 activation and growth of mycosis fungoides tumor cell lines.	STAT6
9317131		1997	Cooperation of binding sites for STAT6 and NF kappa B/rel in the IL-4-induced up-regulation of the human IgE germline promoter.	STAT6
9440542	10.1016/s0091-6749(97)70002-2	1997	A thiol antioxidant regulates IgE isotype switching by inhibiting activation of nuclear factor-kappaB.	STAT6
8624802	10.1016/s1074-7613(00)80676-7	1996	IL-4 function can be transferred to the IL-2 receptor by tyrosine containing sequences found in the IL-4 receptor alpha chain.	STAT6
8624803	10.1016/s1074-7613(00)80677-9	1996	Growth and gene expression are predominantly controlled by distinct regions of the human IL-4 receptor.	STAT6
